,Unnamed: 0,Fighter,Weight class,Method,Round,Time,location,date,fighturl,eventurl
1232,2,Cynthia Calvillo  Pearl Gonzalez,Women's Strawweight,SUB  Rear Naked Choke,3,3:45,"Buffalo, New York, USA",2017-04-08,http://ufcstats.com/fight-details/687d973d71e068dc,http://ufcstats.com/event-details/e7bfdb5e0112891e
1233,3,Thiago Alves  Patrick Cote,Welterweight,U-DEC,3,5:00,"Buffalo, New York, USA",2017-04-08,http://ufcstats.com/fight-details/a68672f66e12a3c2,http://ufcstats.com/event-details/e7bfdb5e0112891e
1234,4,Charles Oliveira  Will Brooks,Lightweight,SUB  Rear Naked Choke,1,2:30,"Buffalo, New York, USA",2017-04-08,http://ufcstats.com/fight-details/56c7c59c9bb3b610,http://ufcstats.com/event-details/e7bfdb5e0112891e
1235,5,Myles Jury  Mike de la Torre,Featherweight,KO/TKO  Punches,1,3:30,"Buffalo, New York, USA",2017-04-08,http://ufcstats.com/fight-details/23ba0218f9f65e33,http://ufcstats.com/event-details/e7bfdb5e0112891e
1236,6,Kamaru Usman  Sean Strickland,Welterweight,U-DEC,3,5:00,"Buffalo, New York, USA",2017-04-08,http://ufcstats.com/fight-details/b2c1f9bdd5d3073d,http://ufcstats.com/event-details/e7bfdb5e0112891e
1237,7,Shane Burgos  Charles Rosa,Featherweight,KO/TKO  Punch,3,1:59,"Buffalo, New York, USA",2017-04-08,http://ufcstats.com/fight-details/ddb015ac5c067aa9,http://ufcstats.com/event-details/e7bfdb5e0112891e
1238,8,Patrick Cummins  Jan Blachowicz,Light Heavyweight,U-DEC,3,5:00,"Buffalo, New York, USA",2017-04-08,http://ufcstats.com/fight-details/e7ad1c3a763c7cae,http://ufcstats.com/event-details/e7bfdb5e0112891e
1239,9,Gregor Gillespie  Andrew Holbrook,Lightweight,KO/TKO  Punch,1,0:21,"Buffalo, New York, USA",2017-04-08,http://ufcstats.com/fight-details/8b4eeaa048361ba3,http://ufcstats.com/event-details/e7bfdb5e0112891e
1240,10,Desmond Green  Josh Emmett,Lightweight,S-DEC,3,5:00,"Buffalo, New York, USA",2017-04-08,http://ufcstats.com/fight-details/97b7638c592a95a9,http://ufcstats.com/event-details/e7bfdb5e0112891e
1241,11,Katlyn Chookagian  Irene Aldana,Women's Bantamweight,S-DEC,3,5:00,"Buffalo, New York, USA",2017-04-08,http://ufcstats.com/fight-details/2464a75ee75dbf2f,http://ufcstats.com/event-details/e7bfdb5e0112891e
1242,12,Magomed Bibulatov  Jenel Lausa,Flyweight,U-DEC,3,5:00,"Buffalo, New York, USA",2017-04-08,http://ufcstats.com/fight-details/c4da9ec26a924a7d,http://ufcstats.com/event-details/e7bfdb5e0112891e
1243,0,Jimi Manuwa  Corey Anderson,Light Heavyweight,KO/TKO  Punch,1,3:05,"London, England, United Kingdom",2017-03-18,http://ufcstats.com/fight-details/00be3852000f8fe9,http://ufcstats.com/event-details/c0231720fe516994
1244,1,Gunnar Nelson  Alan Jouban,Welterweight,SUB  Guillotine Choke,2,0:46,"London, England, United Kingdom",2017-03-18,http://ufcstats.com/fight-details/7e6f91cbf8e93210,http://ufcstats.com/event-details/c0231720fe516994
1245,2,Marlon Vera  Brad Pickett,Catch Weight,KO/TKO  Kick,3,3:50,"London, England, United Kingdom",2017-03-18,http://ufcstats.com/fight-details/1e5c66d12761d4fe,http://ufcstats.com/event-details/c0231720fe516994
1246,3,Arnold Allen  Makwan Amirkhani,Featherweight,S-DEC,3,5:00,"London, England, United Kingdom",2017-03-18,http://ufcstats.com/fight-details/7ec86f2af631344f,http://ufcstats.com/event-details/c0231720fe516994
1247,4,Joe Duffy  Reza Madadi,Lightweight,U-DEC,3,5:00,"London, England, United Kingdom",2017-03-18,http://ufcstats.com/fight-details/55f727e00553035d,http://ufcstats.com/event-details/c0231720fe516994
1248,5,Francimar Barroso  Darren Stewart,Light Heavyweight,U-DEC,3,5:00,"London, England, United Kingdom",2017-03-18,http://ufcstats.com/fight-details/c365a488a8de3c89,http://ufcstats.com/event-details/c0231720fe516994
1249,6,Tim Johnson  Daniel Omielanczuk,Heavyweight,S-DEC,3,5:00,"London, England, United Kingdom",2017-03-18,http://ufcstats.com/fight-details/f99ee57f75b20b69,http://ufcstats.com/event-details/c0231720fe516994
1250,7,Leon Edwards  Vicente Luque,Welterweight,U-DEC,3,5:00,"London, England, United Kingdom",2017-03-18,http://ufcstats.com/fight-details/88ce808e4e604180,http://ufcstats.com/event-details/c0231720fe516994
1251,8,Marc Diakiese  Teemu Packalen,Lightweight,KO/TKO  Punch,1,0:30,"London, England, United Kingdom",2017-03-18,http://ufcstats.com/fight-details/eee7f546c126ee8b,http://ufcstats.com/event-details/c0231720fe516994
1252,9,Bradley Scott  Scott Askham,Middleweight,S-DEC,3,5:00,"London, England, United Kingdom",2017-03-18,http://ufcstats.com/fight-details/794b63b4c1e1e789,http://ufcstats.com/event-details/c0231720fe516994
1253,10,Lina Lansberg  Lucie Pudilova,Women's Bantamweight,U-DEC,3,5:00,"London, England, United Kingdom",2017-03-18,http://ufcstats.com/fight-details/0bb419537705fb04,http://ufcstats.com/event-details/c0231720fe516994
1254,1,Mauricio Rua  Gian Villante,Light Heavyweight,KO/TKO  Punch,3,0:59,"Fortaleza, Ceara, Brazil",2017-03-11,http://ufcstats.com/fight-details/34524408fb4d6752,http://ufcstats.com/event-details/47b7e4e60813b7b2
1255,2,Edson Barboza  Beneil Dariush,Lightweight,KO/TKO  Flying Knee,2,3:35,"Fortaleza, Ceara, Brazil",2017-03-11,http://ufcstats.com/fight-details/b47e4f0982938e5b,http://ufcstats.com/event-details/47b7e4e60813b7b2
1256,3,Ray Borg  Jussier Formiga,Flyweight,U-DEC,3,5:00,"Fortaleza, Ceara, Brazil",2017-03-11,http://ufcstats.com/fight-details/74d4e37b97866514,http://ufcstats.com/event-details/47b7e4e60813b7b2
1257,5,Alex Oliveira  Tim Means,Welterweight,SUB  Rear Naked Choke,2,2:38,"Fortaleza, Ceara, Brazil",2017-03-11,http://ufcstats.com/fight-details/24f156a78bd32026,http://ufcstats.com/event-details/47b7e4e60813b7b2
1258,6,Kevin Lee  Francisco Trinaldo,Lightweight,SUB  Rear Naked Choke,2,3:12,"Fortaleza, Ceara, Brazil",2017-03-11,http://ufcstats.com/fight-details/76602c3658d70273,http://ufcstats.com/event-details/47b7e4e60813b7b2
1259,7,Sergio Moraes  Davi Ramos,Welterweight,U-DEC,3,5:00,"Fortaleza, Ceara, Brazil",2017-03-11,http://ufcstats.com/fight-details/f4f5049e789b7716,http://ufcstats.com/event-details/47b7e4e60813b7b2
1260,8,Joe Soto  Rani Yahya,Bantamweight,U-DEC,3,5:00,"Fortaleza, Ceara, Brazil",2017-03-11,http://ufcstats.com/fight-details/dc169cc01d675125,http://ufcstats.com/event-details/47b7e4e60813b7b2
1261,9,Michel Prazeres  Joshua Burkman,Lightweight,SUB  North-South Choke,1,1:42,"Fortaleza, Ceara, Brazil",2017-03-11,http://ufcstats.com/fight-details/12740c6b17779fe9,http://ufcstats.com/event-details/47b7e4e60813b7b2
1262,10,Jeremy Kennedy  Rony Jason,Featherweight,U-DEC,3,5:00,"Fortaleza, Ceara, Brazil",2017-03-11,http://ufcstats.com/fight-details/ebb94e00d6431e7a,http://ufcstats.com/event-details/47b7e4e60813b7b2
1263,11,Paulo Costa  Garreth McLellan,Middleweight,KO/TKO  Punch,1,1:17,"Fortaleza, Ceara, Brazil",2017-03-11,http://ufcstats.com/fight-details/0ace7e71f5d66bc9,http://ufcstats.com/event-details/47b7e4e60813b7b2
1264,0,Tyron Woodley  Stephen Thompson,Welterweight,M-DEC,5,5:00,"Las Vegas, Nevada, USA",2017-03-04,http://ufcstats.com/fight-details/dfc8c5161ea0ccb5,http://ufcstats.com/event-details/20e403a1acfef130
1265,1,David Teymur  Lando Vannata,Lightweight,U-DEC,3,5:00,"Las Vegas, Nevada, USA",2017-03-04,http://ufcstats.com/fight-details/7ac4b9823b1e139b,http://ufcstats.com/event-details/20e403a1acfef130
1266,2,Daniel Kelly  Rashad Evans,Middleweight,S-DEC,3,5:00,"Las Vegas, Nevada, USA",2017-03-04,http://ufcstats.com/fight-details/e3ca9462ad0d7685,http://ufcstats.com/event-details/20e403a1acfef130
1267,3,Cynthia Calvillo  Amanda Cooper,Women's Strawweight,SUB  Rear Naked Choke,1,3:19,"Las Vegas, Nevada, USA",2017-03-04,http://ufcstats.com/fight-details/54f9e3e1fad7a589,http://ufcstats.com/event-details/20e403a1acfef130
1268,4,Alistair Overeem  Mark Hunt,Heavyweight,KO/TKO  Knees,3,1:44,"Las Vegas, Nevada, USA",2017-03-04,http://ufcstats.com/fight-details/c79b862be039d9f0,http://ufcstats.com/event-details/20e403a1acfef130
1269,5,Marcin Tybura  Luis Henrique,Heavyweight,KO/TKO  Punches,3,3:46,"Las Vegas, Nevada, USA",2017-03-04,http://ufcstats.com/fight-details/42ad1437a1280294,http://ufcstats.com/event-details/20e403a1acfef130
1270,6,Darren Elkins  Mirsad Bektic,Featherweight,KO/TKO  Kick,3,3:19,"Las Vegas, Nevada, USA",2017-03-04,http://ufcstats.com/fight-details/3b536afcc9098925,http://ufcstats.com/event-details/20e403a1acfef130
1271,7,Iuri Alcantara  Luke Sanders,Bantamweight,SUB  Kneebar,2,3:13,"Las Vegas, Nevada, USA",2017-03-04,http://ufcstats.com/fight-details/4804776154430aad,http://ufcstats.com/event-details/20e403a1acfef130
1272,8,Mark Godbeer  Daniel Spitz,Heavyweight,U-DEC,3,5:00,"Las Vegas, Nevada, USA",2017-03-04,http://ufcstats.com/fight-details/08b65f5009c34997,http://ufcstats.com/event-details/20e403a1acfef130
1273,9,Tyson Pedro  Paul Craig,Light Heavyweight,KO/TKO  Elbows,1,4:10,"Las Vegas, Nevada, USA",2017-03-04,http://ufcstats.com/fight-details/6db4d7827082d5b9,http://ufcstats.com/event-details/20e403a1acfef130
1274,10,Albert Morales  Andre Soukhamthath,Bantamweight,S-DEC,3,5:00,"Las Vegas, Nevada, USA",2017-03-04,http://ufcstats.com/fight-details/2d4743a82fc55642,http://ufcstats.com/event-details/20e403a1acfef130
1275,0,Derrick Lewis  Travis Browne,Heavyweight,KO/TKO  Punch,2,3:12,"Halifax, Nova Scotia, Canada",2017-02-19,http://ufcstats.com/fight-details/ab14dbff9d2ae41a,http://ufcstats.com/event-details/b4ad3a06ee4d660c
1276,1,Johny Hendricks  Hector Lombard,Middleweight,U-DEC,3,5:00,"Halifax, Nova Scotia, Canada",2017-02-19,http://ufcstats.com/fight-details/a5d24caed8afbeef,http://ufcstats.com/event-details/b4ad3a06ee4d660c
1277,2,Gavin Tucker  Sam Sicilia,Featherweight,U-DEC,3,5:00,"Halifax, Nova Scotia, Canada",2017-02-19,http://ufcstats.com/fight-details/112e6a0ddce893e6,http://ufcstats.com/event-details/b4ad3a06ee4d660c
1278,3,Elias Theodorou  Cezar Ferreira,Middleweight,U-DEC,3,5:00,"Halifax, Nova Scotia, Canada",2017-02-19,http://ufcstats.com/fight-details/16e28dd989ee1dea,http://ufcstats.com/event-details/b4ad3a06ee4d660c
1279,4,Sara McMann  Gina Mazany,Women's Bantamweight,SUB  Arm Triangle,1,1:14,"Halifax, Nova Scotia, Canada",2017-02-19,http://ufcstats.com/fight-details/9c256e94c6b584b6,http://ufcstats.com/event-details/b4ad3a06ee4d660c
1280,5,Paul Felder  Alessandro Ricci,Lightweight,KO/TKO  Elbow,1,4:44,"Halifax, Nova Scotia, Canada",2017-02-19,http://ufcstats.com/fight-details/f00ac5af033f44b4,http://ufcstats.com/event-details/b4ad3a06ee4d660c
1281,6,Santiago Ponzinibbio  Nordine Taleb,Welterweight,U-DEC,3,5:00,"Halifax, Nova Scotia, Canada",2017-02-19,http://ufcstats.com/fight-details/1db121859d2fcda8,http://ufcstats.com/event-details/b4ad3a06ee4d660c
1282,7,Randa Markos  Carla Esparza,Women's Strawweight,S-DEC,3,5:00,"Halifax, Nova Scotia, Canada",2017-02-19,http://ufcstats.com/fight-details/e4c4c54a10e06973,http://ufcstats.com/event-details/b4ad3a06ee4d660c
1283,8,Aiemann Zahabi  Reginaldo Vieira,Bantamweight,U-DEC,3,5:00,"Halifax, Nova Scotia, Canada",2017-02-19,http://ufcstats.com/fight-details/ad9ecef413a5b48f,http://ufcstats.com/event-details/b4ad3a06ee4d660c
1284,9,Thiago Santos  Jack Marshman,Middleweight,KO/TKO  Kick,2,2:21,"Halifax, Nova Scotia, Canada",2017-02-19,http://ufcstats.com/fight-details/e59aabdfba9d6c45,http://ufcstats.com/event-details/b4ad3a06ee4d660c
1285,10,Gerald Meerschaert  Ryan Janes,Middleweight,SUB  Armbar,1,1:34,"Halifax, Nova Scotia, Canada",2017-02-19,http://ufcstats.com/fight-details/c1d86f1e6d41cd03,http://ufcstats.com/event-details/b4ad3a06ee4d660c
1286,0,Germaine de Randamie  Holly Holm,Women's Featherweight,U-DEC,5,5:00,"Brooklyn, New York, USA",2017-02-11,http://ufcstats.com/fight-details/252074c8554bf30d,http://ufcstats.com/event-details/865aa315ea62c511
1287,1,Anderson Silva  Derek Brunson,Middleweight,U-DEC,3,5:00,"Brooklyn, New York, USA",2017-02-11,http://ufcstats.com/fight-details/d29750cee389a0b9,http://ufcstats.com/event-details/865aa315ea62c511
1288,2,Jacare Souza  Tim Boetsch,Middleweight,SUB  Kimura,1,3:41,"Brooklyn, New York, USA",2017-02-11,http://ufcstats.com/fight-details/ced241b99eab5f22,http://ufcstats.com/event-details/865aa315ea62c511
1289,3,Glover Teixeira  Jared Cannonier,Light Heavyweight,U-DEC,3,5:00,"Brooklyn, New York, USA",2017-02-11,http://ufcstats.com/fight-details/244357514dd89bd6,http://ufcstats.com/event-details/865aa315ea62c511
1290,4,Dustin Poirier  Jim Miller,Lightweight,M-DEC,3,5:00,"Brooklyn, New York, USA",2017-02-11,http://ufcstats.com/fight-details/8b8f9485214f9e48,http://ufcstats.com/event-details/865aa315ea62c511
1291,5,Belal Muhammad  Randy Brown,Welterweight,U-DEC,3,5:00,"Brooklyn, New York, USA",2017-02-11,http://ufcstats.com/fight-details/f680e6ebe3bdfe3e,http://ufcstats.com/event-details/865aa315ea62c511
1292,6,Wilson Reis  Ulka Sasaki,Flyweight,U-DEC,3,5:00,"Brooklyn, New York, USA",2017-02-11,http://ufcstats.com/fight-details/febea68b205f6273,http://ufcstats.com/event-details/865aa315ea62c511
1293,7,Islam Makhachev  Nik Lentz,Lightweight,U-DEC,3,5:00,"Brooklyn, New York, USA",2017-02-11,http://ufcstats.com/fight-details/ddd9e64d97b095f9,http://ufcstats.com/event-details/865aa315ea62c511
1294,8,Rick Glenn  Phillipe Nover,Featherweight,S-DEC,3,5:00,"Brooklyn, New York, USA",2017-02-11,http://ufcstats.com/fight-details/c4174e22cb22622c,http://ufcstats.com/event-details/865aa315ea62c511
1295,9,Ryan LaFlare  Roan Carneiro,Welterweight,U-DEC,3,5:00,"Brooklyn, New York, USA",2017-02-11,http://ufcstats.com/fight-details/1f9ac1648b8e501e,http://ufcstats.com/event-details/865aa315ea62c511
1296,0,Chan Sung Jung  Dennis Bermudez,Featherweight,KO/TKO  Punch,1,2:29,"Houston, Texas, USA",2017-02-04,http://ufcstats.com/fight-details/8c220d4c96895a98,http://ufcstats.com/event-details/6a8a06b542e1516d
1297,1,Felice Herrig  Alexa Grasso,Women's Strawweight,U-DEC,3,5:00,"Houston, Texas, USA",2017-02-04,http://ufcstats.com/fight-details/4a2e7e2c8cfdaf5f,http://ufcstats.com/event-details/6a8a06b542e1516d
1298,2,James Vick  Abel Trujillo,Lightweight,SUB  D'Arce Choke,3,0:49,"Houston, Texas, USA",2017-02-04,http://ufcstats.com/fight-details/94cecf4bd29793e1,http://ufcstats.com/event-details/6a8a06b542e1516d
1299,3,Volkan Oezdemir  Ovince Saint Preux,Light Heavyweight,S-DEC,3,5:00,"Houston, Texas, USA",2017-02-04,http://ufcstats.com/fight-details/36220644401d85e1,http://ufcstats.com/event-details/6a8a06b542e1516d
1300,4,Marcel Fortuna  Anthony Hamilton,Heavyweight,KO/TKO  Punch,1,3:10,"Houston, Texas, USA",2017-02-04,http://ufcstats.com/fight-details/49e344834626c144,http://ufcstats.com/event-details/6a8a06b542e1516d
1301,5,Jessica Andrade  Angela Hill,Women's Strawweight,U-DEC,3,5:00,"Houston, Texas, USA",2017-02-04,http://ufcstats.com/fight-details/451525a1abe30a91,http://ufcstats.com/event-details/6a8a06b542e1516d
1302,7,Chas Skelly  Chris Gruetzemacher,Featherweight,SUB  Rear Naked Choke,2,2:01,"Houston, Texas, USA",2017-02-04,http://ufcstats.com/fight-details/478221ad98336565,http://ufcstats.com/event-details/6a8a06b542e1516d
1303,8,Ricardo Ramos  Michinori Tanaka,Bantamweight,U-DEC,3,5:00,"Houston, Texas, USA",2017-02-04,http://ufcstats.com/fight-details/66ad9f88f063d2ef,http://ufcstats.com/event-details/6a8a06b542e1516d
1304,9,Tecia Torres  Bec Rawlings,Women's Strawweight,U-DEC,3,5:00,"Houston, Texas, USA",2017-02-04,http://ufcstats.com/fight-details/ebe38ba75cbf2320,http://ufcstats.com/event-details/6a8a06b542e1516d
1305,11,Khalil Rountree Jr.  Daniel Jolly,Light Heavyweight,KO/TKO  Knees,1,0:52,"Houston, Texas, USA",2017-02-04,http://ufcstats.com/fight-details/f3bb58f485dc2008,http://ufcstats.com/event-details/6a8a06b542e1516d
1306,0,Valentina Shevchenko  Julianna Pena,Women's Bantamweight,SUB  Armbar,2,4:29,"Denver, Colorado, USA",2017-01-28,http://ufcstats.com/fight-details/ab79fe7b35ccc3dc,http://ufcstats.com/event-details/4512e46543b960ad
1307,1,Jorge Masvidal  Donald Cerrone,Welterweight,KO/TKO  Punches,2,1:00,"Denver, Colorado, USA",2017-01-28,http://ufcstats.com/fight-details/b91756d955e14d2e,http://ufcstats.com/event-details/4512e46543b960ad
1308,2,Francis Ngannou  Andrei Arlovski,Heavyweight,KO/TKO  Punch,1,1:32,"Denver, Colorado, USA",2017-01-28,http://ufcstats.com/fight-details/a45596cda51a1816,http://ufcstats.com/event-details/4512e46543b960ad
1309,3,Jason Knight  Alex Caceres,Featherweight,SUB  Rear Naked Choke,2,4:21,"Denver, Colorado, USA",2017-01-28,http://ufcstats.com/fight-details/43682a646b9b956f,http://ufcstats.com/event-details/4512e46543b960ad
1310,4,Sam Alvey  Nate Marquardt,Middleweight,U-DEC,3,5:00,"Denver, Colorado, USA",2017-01-28,http://ufcstats.com/fight-details/3c8eb8ad5e98876f,http://ufcstats.com/event-details/4512e46543b960ad
1311,5,Raphael Assuncao  Aljamain Sterling,Bantamweight,S-DEC,3,5:00,"Denver, Colorado, USA",2017-01-28,http://ufcstats.com/fight-details/637f561cd731fb44,http://ufcstats.com/event-details/4512e46543b960ad
1312,6,Jingliang Li  Bobby Nash,Welterweight,KO/TKO  Punch,2,4:45,"Denver, Colorado, USA",2017-01-28,http://ufcstats.com/fight-details/c5865afc31cb6c59,http://ufcstats.com/event-details/4512e46543b960ad
1313,7,Jordan Johnson  Henrique da Silva,Light Heavyweight,U-DEC,3,5:00,"Denver, Colorado, USA",2017-01-28,http://ufcstats.com/fight-details/1cd0ce0e2312ad52,http://ufcstats.com/event-details/4512e46543b960ad
1314,8,Eric Spicely  Alessio Di Chirico,Middleweight,SUB  Triangle Choke,1,2:14,"Denver, Colorado, USA",2017-01-28,http://ufcstats.com/fight-details/481aef2d2802ec68,http://ufcstats.com/event-details/4512e46543b960ad
1315,9,Marcos Rogerio de Lima  Jeremy Kimball,Light Heavyweight,KO/TKO  Punches,1,2:27,"Denver, Colorado, USA",2017-01-28,http://ufcstats.com/fight-details/99373dc33dfbf6e0,http://ufcstats.com/event-details/4512e46543b960ad
1316,10,Alexandre Pantoja  Eric Shelton,Flyweight,S-DEC,3,5:00,"Denver, Colorado, USA",2017-01-28,http://ufcstats.com/fight-details/0094d2ed98819f7a,http://ufcstats.com/event-details/4512e46543b960ad
1317,11,Jason Gonzalez  JC Cottrell,Lightweight,SUB  D'Arce Choke,1,3:54,"Denver, Colorado, USA",2017-01-28,http://ufcstats.com/fight-details/6eb382e2c51fc4f5,http://ufcstats.com/event-details/4512e46543b960ad
1318,0,Yair Rodriguez  BJ Penn,Featherweight,KO/TKO  Punches,2,0:24,"Phoenix, Arizona, USA",2017-01-15,http://ufcstats.com/fight-details/5742025a09190829,http://ufcstats.com/event-details/46effbd1135423c5
1319,1,Joe Lauzon  Marcin Held,Lightweight,S-DEC,3,5:00,"Phoenix, Arizona, USA",2017-01-15,http://ufcstats.com/fight-details/00720c46f864fe03,http://ufcstats.com/event-details/46effbd1135423c5
1320,2,Ben Saunders  Court McGee,Welterweight,U-DEC,3,5:00,"Phoenix, Arizona, USA",2017-01-15,http://ufcstats.com/fight-details/8edb831924d69dd9,http://ufcstats.com/event-details/46effbd1135423c5
1321,3,Sergio Pettis  John Moraga,Flyweight,U-DEC,3,5:00,"Phoenix, Arizona, USA",2017-01-15,http://ufcstats.com/fight-details/7685701c382cd49a,http://ufcstats.com/event-details/46effbd1135423c5
1322,4,Drakkar Klose  Devin Powell,Lightweight,U-DEC,3,5:00,"Phoenix, Arizona, USA",2017-01-15,http://ufcstats.com/fight-details/bbb67c2ac4453d64,http://ufcstats.com/event-details/46effbd1135423c5
1323,5,Augusto Mendes  Frankie Saenz,Bantamweight,S-DEC,3,5:00,"Phoenix, Arizona, USA",2017-01-15,http://ufcstats.com/fight-details/b60bbec8ec98941b,http://ufcstats.com/event-details/46effbd1135423c5
1324,6,Aleksei Oleinik  Viktor Pesta,Heavyweight,SUB  Other - Choke,1,2:57,"Phoenix, Arizona, USA",2017-01-15,http://ufcstats.com/fight-details/1a81573425c585fb,http://ufcstats.com/event-details/46effbd1135423c5
1325,7,Anthony Rocco Martin  Alex White,Lightweight,U-DEC,3,5:00,"Phoenix, Arizona, USA",2017-01-15,http://ufcstats.com/fight-details/8156479490877d08,http://ufcstats.com/event-details/46effbd1135423c5
1326,8,Nina Ansaroff  Jocelyn Jones-Lybarger,Women's Strawweight,SUB  Rear Naked Choke,3,3:39,"Phoenix, Arizona, USA",2017-01-15,http://ufcstats.com/fight-details/53c3565ee1d3411a,http://ufcstats.com/event-details/46effbd1135423c5
1327,9,Walt Harris  Chase Sherman,Heavyweight,KO/TKO  Knee,2,2:41,"Phoenix, Arizona, USA",2017-01-15,http://ufcstats.com/fight-details/3f7684492c9df05e,http://ufcstats.com/event-details/46effbd1135423c5
1328,10,Joachim Christensen  Bojan Mihajlovic,Light Heavyweight,KO/TKO  Punches,3,2:05,"Phoenix, Arizona, USA",2017-01-15,http://ufcstats.com/fight-details/ae803440d778a12b,http://ufcstats.com/event-details/46effbd1135423c5
1329,11,Cyril Asker  Dmitrii Smoliakov,Heavyweight,KO/TKO  Punches,1,2:41,"Phoenix, Arizona, USA",2017-01-15,http://ufcstats.com/fight-details/c1356395d6b055d7,http://ufcstats.com/event-details/46effbd1135423c5
1330,0,Amanda Nunes  Ronda Rousey,Women's Bantamweight,KO/TKO  Punches,1,0:48,"Las Vegas, Nevada, USA",2016-12-30,http://ufcstats.com/fight-details/0aad210fbaa1db6c,http://ufcstats.com/event-details/4b2390cfaceb91d8
1331,1,Cody Garbrandt  Dominick Cruz,Bantamweight,U-DEC,5,5:00,"Las Vegas, Nevada, USA",2016-12-30,http://ufcstats.com/fight-details/25e6b11e1cf45b83,http://ufcstats.com/event-details/4b2390cfaceb91d8
1332,2,TJ Dillashaw  John Lineker,Bantamweight,U-DEC,3,5:00,"Las Vegas, Nevada, USA",2016-12-30,http://ufcstats.com/fight-details/7f663d67422c1b24,http://ufcstats.com/event-details/4b2390cfaceb91d8
1333,3,Dong Hyun Kim  Tarec Saffiedine,Welterweight,S-DEC,3,5:00,"Las Vegas, Nevada, USA",2016-12-30,http://ufcstats.com/fight-details/3d07a533feca7458,http://ufcstats.com/event-details/4b2390cfaceb91d8
1334,4,Ray Borg  Louis Smolka,Flyweight,U-DEC,3,5:00,"Las Vegas, Nevada, USA",2016-12-30,http://ufcstats.com/fight-details/ab847a4cf397d7d5,http://ufcstats.com/event-details/4b2390cfaceb91d8
1335,5,Neil Magny  Johny Hendricks,Welterweight,U-DEC,3,5:00,"Las Vegas, Nevada, USA",2016-12-30,http://ufcstats.com/fight-details/abf0f8234f6be37e,http://ufcstats.com/event-details/4b2390cfaceb91d8
1336,6,Antonio Carlos Junior  Marvin Vettori,Middleweight,U-DEC,3,5:00,"Las Vegas, Nevada, USA",2016-12-30,http://ufcstats.com/fight-details/78736e322574e500,http://ufcstats.com/event-details/4b2390cfaceb91d8
1337,7,Alex Garcia  Mike Pyle,Welterweight,KO/TKO  Punch,1,3:34,"Las Vegas, Nevada, USA",2016-12-30,http://ufcstats.com/fight-details/31acf87e89a4a401,http://ufcstats.com/event-details/4b2390cfaceb91d8
1338,8,Niko Price  Brandon Thatch,Welterweight,SUB  Arm Triangle,1,4:30,"Las Vegas, Nevada, USA",2016-12-30,http://ufcstats.com/fight-details/d8c7497043e7e5bd,http://ufcstats.com/event-details/4b2390cfaceb91d8
1339,0,Michelle Waterson  Paige VanZant,Women's Strawweight,SUB  Rear Naked Choke,1,3:21,"Sacramento, California, USA",2016-12-17,http://ufcstats.com/fight-details/5840527835a8ffb2,http://ufcstats.com/event-details/32541eb5d12668b4
1340,1,Mickey Gall  Sage Northcutt,Welterweight,SUB  Rear Naked Choke,2,1:40,"Sacramento, California, USA",2016-12-17,http://ufcstats.com/fight-details/23bc29f1b6baacad,http://ufcstats.com/event-details/32541eb5d12668b4
1341,2,Urijah Faber  Brad Pickett,Bantamweight,U-DEC,3,5:00,"Sacramento, California, USA",2016-12-17,http://ufcstats.com/fight-details/2cdf841a057d9039,http://ufcstats.com/event-details/32541eb5d12668b4
1342,3,Alan Jouban  Mike Perry,Welterweight,U-DEC,3,5:00,"Sacramento, California, USA",2016-12-17,http://ufcstats.com/fight-details/473b9b56cdaedba3,http://ufcstats.com/event-details/32541eb5d12668b4
1343,4,Paul Craig  Henrique da Silva,Light Heavyweight,SUB  Armbar,2,1:59,"Sacramento, California, USA",2016-12-17,http://ufcstats.com/fight-details/01f396a7372dc8ff,http://ufcstats.com/event-details/32541eb5d12668b4
1344,5,Mizuto Hirota  Cole Miller,Featherweight,U-DEC,3,5:00,"Sacramento, California, USA",2016-12-17,http://ufcstats.com/fight-details/4b35edc671de861f,http://ufcstats.com/event-details/32541eb5d12668b4
1345,6,Colby Covington  Bryan Barberena,Welterweight,U-DEC,3,5:00,"Sacramento, California, USA",2016-12-17,http://ufcstats.com/fight-details/677588ea237aa5c0,http://ufcstats.com/event-details/32541eb5d12668b4
1346,7,Alex Morono  James Moontasri,Welterweight,U-DEC,3,5:00,"Sacramento, California, USA",2016-12-17,http://ufcstats.com/fight-details/30f6cf4253b13b76,http://ufcstats.com/event-details/32541eb5d12668b4
1347,8,Josh Emmett  Scott Holtzman,Lightweight,U-DEC,3,5:00,"Sacramento, California, USA",2016-12-17,http://ufcstats.com/fight-details/7979888b1fb5eb39,http://ufcstats.com/event-details/32541eb5d12668b4
1348,9,Leslie Smith  Irene Aldana,Women's Bantamweight,U-DEC,3,5:00,"Sacramento, California, USA",2016-12-17,http://ufcstats.com/fight-details/d77ace7aadb2383e,http://ufcstats.com/event-details/32541eb5d12668b4
1349,10,Eddie Wineland  Takeya Mizugaki,Bantamweight,KO/TKO  Punches,1,3:04,"Sacramento, California, USA",2016-12-17,http://ufcstats.com/fight-details/ca6d4239726931f9,http://ufcstats.com/event-details/32541eb5d12668b4
1350,11,Hector Sandoval  Fredy Serrano,Flyweight,U-DEC,3,5:00,"Sacramento, California, USA",2016-12-17,http://ufcstats.com/fight-details/88c712be47805d63,http://ufcstats.com/event-details/32541eb5d12668b4
1351,12,Sultan Aliev  Bojan Velickovic,Welterweight,S-DEC,3,5:00,"Sacramento, California, USA",2016-12-17,http://ufcstats.com/fight-details/1ca4274019680d23,http://ufcstats.com/event-details/32541eb5d12668b4
1352,0,Max Holloway  Anthony Pettis,Featherweight,KO/TKO  Punches,3,4:50,"Toronto, Ontario, Canada",2016-12-10,http://ufcstats.com/fight-details/977a758d869f9e7a,http://ufcstats.com/event-details/6e3282d57d2467a0
1353,1,Donald Cerrone  Matt Brown,Welterweight,KO/TKO  Kick,3,0:34,"Toronto, Ontario, Canada",2016-12-10,http://ufcstats.com/fight-details/96404a3b32791c8d,http://ufcstats.com/event-details/6e3282d57d2467a0
1354,2,Cub Swanson  Dooho Choi,Featherweight,U-DEC,3,5:00,"Toronto, Ontario, Canada",2016-12-10,http://ufcstats.com/fight-details/5f0aa841c21f7d30,http://ufcstats.com/event-details/6e3282d57d2467a0
1355,3,Kelvin Gastelum  Tim Kennedy,Middleweight,KO/TKO  Punches,3,2:45,"Toronto, Ontario, Canada",2016-12-10,http://ufcstats.com/fight-details/07b98dbf5d2c62a2,http://ufcstats.com/event-details/6e3282d57d2467a0
