,Unnamed: 0,Fighter,Weight class,Method,Round,Time,location,date,fighturl,eventurl
3459,9,Chris Camozzi  Dustin Jacoby,Middleweight,SUB  Guillotine Choke,3,1:08,"Chicago, Illinois, USA",2012-01-28,http://ufcstats.com/fight-details/7a37fd92b26d15c8,http://ufcstats.com/event-details/c3c23c99477c041b
3460,0,Jim Miller  Melvin Guillard,Lightweight,SUB  Rear Naked Choke,1,3:04,"Nashville, Tennessee, USA",2012-01-20,http://ufcstats.com/fight-details/90d50fb7e2bf789e,http://ufcstats.com/event-details/4d74641fac830182
3461,1,Josh Neer  Duane Ludwig,Welterweight,SUB  Guillotine Choke,1,3:04,"Nashville, Tennessee, USA",2012-01-20,http://ufcstats.com/fight-details/d391ca8154bcf507,http://ufcstats.com/event-details/4d74641fac830182
3462,2,Mike Easton  Jared Papazian,Bantamweight,M-DEC,3,5:00,"Nashville, Tennessee, USA",2012-01-20,http://ufcstats.com/fight-details/77c1e127c1be9983,http://ufcstats.com/event-details/4d74641fac830182
3463,3,Pat Barry  Christian Morecraft,Heavyweight,KO/TKO  Punch,1,3:38,"Nashville, Tennessee, USA",2012-01-20,http://ufcstats.com/fight-details/fc91f1e448f35797,http://ufcstats.com/event-details/4d74641fac830182
3464,4,Jorge Rivera  Eric Schafer,Middleweight,KO/TKO  Punches,2,1:31,"Nashville, Tennessee, USA",2012-01-20,http://ufcstats.com/fight-details/0071c5d16e6e07f6,http://ufcstats.com/event-details/4d74641fac830182
3465,5,Khabib Nurmagomedov  Kamal Shalorus,Lightweight,SUB  Rear Naked Choke,3,2:08,"Nashville, Tennessee, USA",2012-01-20,http://ufcstats.com/fight-details/8360accf6f70ebc4,http://ufcstats.com/event-details/4d74641fac830182
3466,6,Charlie Brenneman  Daniel Roberts,Welterweight,U-DEC,3,5:00,"Nashville, Tennessee, USA",2012-01-20,http://ufcstats.com/fight-details/be7b9301e7c689c1,http://ufcstats.com/event-details/4d74641fac830182
3467,7,Fabricio Camoes  Tommy Hayden,Lightweight,SUB  Rear Naked Choke,1,4:03,"Nashville, Tennessee, USA",2012-01-20,http://ufcstats.com/fight-details/37e0251af7b18742,http://ufcstats.com/event-details/4d74641fac830182
3468,8,Daniel Pineda  Pat Schilling,Featherweight,SUB  Rear Naked Choke,1,1:37,"Nashville, Tennessee, USA",2012-01-20,http://ufcstats.com/fight-details/f4bdf10856c1760e,http://ufcstats.com/event-details/4d74641fac830182
3469,9,Nick Denis  Joseph Sandoval,Bantamweight,KO/TKO  Elbows,1,0:22,"Nashville, Tennessee, USA",2012-01-20,http://ufcstats.com/fight-details/26cdaf7cf575f656,http://ufcstats.com/event-details/4d74641fac830182
3470,0,Jose Aldo  Chad Mendes,Featherweight,KO/TKO  Knee,1,4:59,"Rio de Janeiro, Brazil",2012-01-14,http://ufcstats.com/fight-details/9afcb091777f6a83,http://ufcstats.com/event-details/18524b46c570730b
3471,1,Vitor Belfort  Anthony Johnson,Middleweight,SUB  Rear Naked Choke,1,4:49,"Rio de Janeiro, Brazil",2012-01-14,http://ufcstats.com/fight-details/50bdcb20286690ff,http://ufcstats.com/event-details/18524b46c570730b
3472,2,Rousimar Palhares  Mike Massenzio,Middleweight,SUB  Heel Hook,1,1:03,"Rio de Janeiro, Brazil",2012-01-14,http://ufcstats.com/fight-details/c715c165cb3469d2,http://ufcstats.com/event-details/18524b46c570730b
3473,3,Carlo Prater  Erick Silva,Welterweight,DQ,1,0:29,"Rio de Janeiro, Brazil",2012-01-14,http://ufcstats.com/fight-details/b2a91be41c3233cd,http://ufcstats.com/event-details/18524b46c570730b
3474,4,Edson Barboza  Terry Etim,Lightweight,KO/TKO  Kick,3,2:02,"Rio de Janeiro, Brazil",2012-01-14,http://ufcstats.com/fight-details/11e7f12ecb2d1597,http://ufcstats.com/event-details/18524b46c570730b
3475,5,Thiago Tavares  Sam Stout,Lightweight,U-DEC,3,5:00,"Rio de Janeiro, Brazil",2012-01-14,http://ufcstats.com/fight-details/977e37adadd1b8ad,http://ufcstats.com/event-details/18524b46c570730b
3476,6,Gabriel Gonzaga  Ednaldo Oliveira,Heavyweight,SUB  Rear Naked Choke,1,3:22,"Rio de Janeiro, Brazil",2012-01-14,http://ufcstats.com/fight-details/0695d1f42b1550a2,http://ufcstats.com/event-details/18524b46c570730b
3477,7,Iuri Alcantara  Michihiro Omigawa,Featherweight,U-DEC,3,5:00,"Rio de Janeiro, Brazil",2012-01-14,http://ufcstats.com/fight-details/0be68308b5d63a47,http://ufcstats.com/event-details/18524b46c570730b
3478,8,Mike Pyle  Ricardo Funch,Welterweight,KO/TKO  Knees,1,1:22,"Rio de Janeiro, Brazil",2012-01-14,http://ufcstats.com/fight-details/f126491f024c1563,http://ufcstats.com/event-details/18524b46c570730b
3479,9,Felipe Arantes  Antonio Carvalho,Featherweight,U-DEC,3,5:00,"Rio de Janeiro, Brazil",2012-01-14,http://ufcstats.com/fight-details/7bb603674999e675,http://ufcstats.com/event-details/18524b46c570730b
3480,0,Alistair Overeem  Brock Lesnar,Heavyweight,KO/TKO  Kick,1,2:26,"Las Vegas, Nevada, USA",2011-12-30,http://ufcstats.com/fight-details/5c3325b7da3f7828,http://ufcstats.com/event-details/91720876db0ee468
3481,1,Nate Diaz  Donald Cerrone,Lightweight,U-DEC,3,5:00,"Las Vegas, Nevada, USA",2011-12-30,http://ufcstats.com/fight-details/d940ffe543c4e38b,http://ufcstats.com/event-details/91720876db0ee468
3482,2,Johny Hendricks  Jon Fitch,Welterweight,KO/TKO  Punch,1,0:12,"Las Vegas, Nevada, USA",2011-12-30,http://ufcstats.com/fight-details/b9508f47504ccc59,http://ufcstats.com/event-details/91720876db0ee468
3483,3,Alexander Gustafsson  Vladimir Matyushenko,Light Heavyweight,KO/TKO  Punch,1,2:13,"Las Vegas, Nevada, USA",2011-12-30,http://ufcstats.com/fight-details/607722017a9d7e22,http://ufcstats.com/event-details/91720876db0ee468
3484,4,Jimy Hettes  Nam Phan,Featherweight,U-DEC,3,5:00,"Las Vegas, Nevada, USA",2011-12-30,http://ufcstats.com/fight-details/eeef3df8adb8acc7,http://ufcstats.com/event-details/91720876db0ee468
3485,5,Ross Pearson  Junior Assuncao,Featherweight,U-DEC,3,5:00,"Las Vegas, Nevada, USA",2011-12-30,http://ufcstats.com/fight-details/434411f139e51760,http://ufcstats.com/event-details/91720876db0ee468
3486,6,Danny Castillo  Anthony Njokuani,Lightweight,S-DEC,3,5:00,"Las Vegas, Nevada, USA",2011-12-30,http://ufcstats.com/fight-details/68137e9ff22d426b,http://ufcstats.com/event-details/91720876db0ee468
3487,7,Dong Hyun Kim  Sean Pierson,Welterweight,U-DEC,3,5:00,"Las Vegas, Nevada, USA",2011-12-30,http://ufcstats.com/fight-details/972034fcd94ca83b,http://ufcstats.com/event-details/91720876db0ee468
3488,8,Jacob Volkmann  Efrain Escudero,Lightweight,U-DEC,3,5:00,"Las Vegas, Nevada, USA",2011-12-30,http://ufcstats.com/fight-details/46bea6d63ffe17e4,http://ufcstats.com/event-details/91720876db0ee468
3489,9,Diego Nunes  Manvel Gamburyan,Featherweight,U-DEC,3,5:00,"Las Vegas, Nevada, USA",2011-12-30,http://ufcstats.com/fight-details/2f715933d0626544,http://ufcstats.com/event-details/91720876db0ee468
3490,0,Jon Jones  Lyoto Machida,Light Heavyweight,SUB  Guillotine Choke,2,4:26,"Toronto, Ontario, Canada",2011-12-10,http://ufcstats.com/fight-details/834968d130e1f0e9,http://ufcstats.com/event-details/6d7886b094b471ac
3491,1,Frank Mir  Minotauro Nogueira,Heavyweight,SUB  Kimura,1,3:38,"Toronto, Ontario, Canada",2011-12-10,http://ufcstats.com/fight-details/92d0c39f0df77c7e,http://ufcstats.com/event-details/6d7886b094b471ac
3492,2,Rogerio Nogueira  Tito Ortiz,Light Heavyweight,KO/TKO  Punches,1,3:15,"Toronto, Ontario, Canada",2011-12-10,http://ufcstats.com/fight-details/69d6d58d58cb81e3,http://ufcstats.com/event-details/6d7886b094b471ac
3493,3,Brian Ebersole  Claude Patrick,Welterweight,S-DEC,3,5:00,"Toronto, Ontario, Canada",2011-12-10,http://ufcstats.com/fight-details/dbe53d31f4c1ccf7,http://ufcstats.com/event-details/6d7886b094b471ac
3494,4,Chan Sung Jung  Mark Hominick,Featherweight,KO/TKO  Punch,1,0:07,"Toronto, Ontario, Canada",2011-12-10,http://ufcstats.com/fight-details/8abe79e6d300b639,http://ufcstats.com/event-details/6d7886b094b471ac
3495,5,Igor Pokrajac  Krzysztof Soszynski,Light Heavyweight,KO/TKO  Punches,1,0:35,"Toronto, Ontario, Canada",2011-12-10,http://ufcstats.com/fight-details/e03ec6b24fca2386,http://ufcstats.com/event-details/6d7886b094b471ac
3496,6,Costas Philippou  Jared Hamman,Middleweight,KO/TKO  Punches,1,3:11,"Toronto, Ontario, Canada",2011-12-10,http://ufcstats.com/fight-details/76d18b94f580be6e,http://ufcstats.com/event-details/6d7886b094b471ac
3497,7,Dennis Hallman  John Makdessi,Lightweight,SUB  Rear Naked Choke,1,2:58,"Toronto, Ontario, Canada",2011-12-10,http://ufcstats.com/fight-details/fd0c847858bd346f,http://ufcstats.com/event-details/6d7886b094b471ac
3498,8,Yves Jabouin  Walel Watson,Bantamweight,S-DEC,3,5:00,"Toronto, Ontario, Canada",2011-12-10,http://ufcstats.com/fight-details/fef109b9f26585b3,http://ufcstats.com/event-details/6d7886b094b471ac
3499,9,Mark Bocek  Nik Lentz,Lightweight,U-DEC,3,5:00,"Toronto, Ontario, Canada",2011-12-10,http://ufcstats.com/fight-details/70995170c27c4143,http://ufcstats.com/event-details/6d7886b094b471ac
3500,10,Jake Hecht  Rich Attonito,Welterweight,KO/TKO  Elbows,2,1:10,"Toronto, Ontario, Canada",2011-12-10,http://ufcstats.com/fight-details/d6d812269487071e,http://ufcstats.com/event-details/6d7886b094b471ac
3501,11,John Cholish  Mitch Clarke,Lightweight,KO/TKO  Punches,2,4:36,"Toronto, Ontario, Canada",2011-12-10,http://ufcstats.com/fight-details/e094423979fc7c6a,http://ufcstats.com/event-details/6d7886b094b471ac
3502,0,Michael Bisping  Jason Miller,Middleweight,KO/TKO  Knees,3,3:34,"Las Vegas, Nevada, USA",2011-12-03,http://ufcstats.com/fight-details/f182b13c6e07dfb1,http://ufcstats.com/event-details/1f5f75658551f2d3
3503,1,Diego Brandao  Dennis Bermudez,Featherweight,SUB  Armbar,1,4:51,"Las Vegas, Nevada, USA",2011-12-03,http://ufcstats.com/fight-details/6e85d8d17c3eed58,http://ufcstats.com/event-details/1f5f75658551f2d3
3504,2,John Dodson  TJ Dillashaw,Bantamweight,KO/TKO  Punches,1,1:54,"Las Vegas, Nevada, USA",2011-12-03,http://ufcstats.com/fight-details/9a3908ab337c5f3f,http://ufcstats.com/event-details/1f5f75658551f2d3
3505,3,Tony Ferguson  Yves Edwards,Lightweight,U-DEC,3,5:00,"Las Vegas, Nevada, USA",2011-12-03,http://ufcstats.com/fight-details/381b2df85ac06615,http://ufcstats.com/event-details/1f5f75658551f2d3
3506,4,Johnny Bedford  Louis Gaudinot,Bantamweight,KO/TKO  Knees,3,1:58,"Las Vegas, Nevada, USA",2011-12-03,http://ufcstats.com/fight-details/25783a9abbfee4fc,http://ufcstats.com/event-details/1f5f75658551f2d3
3507,5,Marcus Brimage  Stephen Bass,Featherweight,U-DEC,3,5:00,"Las Vegas, Nevada, USA",2011-12-03,http://ufcstats.com/fight-details/9821faf6a5d6fd0d,http://ufcstats.com/event-details/1f5f75658551f2d3
3508,6,John Albert  Dustin Pague,Bantamweight,KO/TKO  Punches,1,1:09,"Las Vegas, Nevada, USA",2011-12-03,http://ufcstats.com/fight-details/72481ce1897251cd,http://ufcstats.com/event-details/1f5f75658551f2d3
3509,7,Roland Delorme  Josh Ferguson,Bantamweight,SUB  Rear Naked Choke,3,0:22,"Las Vegas, Nevada, USA",2011-12-03,http://ufcstats.com/fight-details/c302f24082239f82,http://ufcstats.com/event-details/1f5f75658551f2d3
3510,8,Steven Siler  Josh Clopton,Featherweight,U-DEC,3,5:00,"Las Vegas, Nevada, USA",2011-12-03,http://ufcstats.com/fight-details/21ebc940f3dfde82,http://ufcstats.com/event-details/1f5f75658551f2d3
3511,9,Bryan Caraway  Dustin Neace,Featherweight,SUB  Rear Naked Choke,2,3:38,"Las Vegas, Nevada, USA",2011-12-03,http://ufcstats.com/fight-details/b28aad0fdc0b8cc0,http://ufcstats.com/event-details/1f5f75658551f2d3
3512,0,Dan Henderson  Mauricio Rua,Light Heavyweight,U-DEC,5,5:00,"San Jose, California, USA",2011-11-19,http://ufcstats.com/fight-details/206db35805bb83dc,http://ufcstats.com/event-details/0ec821423baa26bd
3513,1,Wanderlei Silva  Cung Le,Middleweight,KO/TKO  Knee,2,4:49,"San Jose, California, USA",2011-11-19,http://ufcstats.com/fight-details/30c574f33700010a,http://ufcstats.com/event-details/0ec821423baa26bd
3514,2,Urijah Faber  Brian Bowles,Bantamweight,SUB  Guillotine Choke,2,1:27,"San Jose, California, USA",2011-11-19,http://ufcstats.com/fight-details/73fd4982ef7aae44,http://ufcstats.com/event-details/0ec821423baa26bd
3515,3,Martin Kampmann  Rick Story,Welterweight,S-DEC,3,5:00,"San Jose, California, USA",2011-11-19,http://ufcstats.com/fight-details/89820fae001dd151,http://ufcstats.com/event-details/0ec821423baa26bd
3516,4,Stephan Bonnar  Kyle Kingsbury,Light Heavyweight,U-DEC,3,5:00,"San Jose, California, USA",2011-11-19,http://ufcstats.com/fight-details/50ffbc85d3c50604,http://ufcstats.com/event-details/0ec821423baa26bd
3517,5,Ryan Bader  Jason Brilz,Light Heavyweight,KO/TKO  Punch,1,1:17,"San Jose, California, USA",2011-11-19,http://ufcstats.com/fight-details/2f5ced39b8208e46,http://ufcstats.com/event-details/0ec821423baa26bd
3518,6,Michael McDonald  Alex Soto,Bantamweight,KO/TKO  Punches,1,0:56,"San Jose, California, USA",2011-11-19,http://ufcstats.com/fight-details/52f77a9f9eb66ab7,http://ufcstats.com/event-details/0ec821423baa26bd
3519,7,Chris Weidman  Tom Lawlor,Middleweight,SUB  D'Arce Choke,1,2:07,"San Jose, California, USA",2011-11-19,http://ufcstats.com/fight-details/f754d17d5047d536,http://ufcstats.com/event-details/0ec821423baa26bd
3520,8,Gleison Tibau  Rafael Dos Anjos,Lightweight,S-DEC,3,5:00,"San Jose, California, USA",2011-11-19,http://ufcstats.com/fight-details/a117805ab030b194,http://ufcstats.com/event-details/0ec821423baa26bd
3521,9,Miguel Torres  Nick Pace,Bantamweight,U-DEC,3,5:00,"San Jose, California, USA",2011-11-19,http://ufcstats.com/fight-details/10f54096561f587d,http://ufcstats.com/event-details/0ec821423baa26bd
3522,10,Seth Baczynski  Matt Brown,Welterweight,SUB  Guillotine Choke,2,0:42,"San Jose, California, USA",2011-11-19,http://ufcstats.com/fight-details/421842986f10851e,http://ufcstats.com/event-details/0ec821423baa26bd
3523,11,Danny Castillo  Shamar Bailey,Lightweight,KO/TKO  Punches,1,4:52,"San Jose, California, USA",2011-11-19,http://ufcstats.com/fight-details/39e7bb2a0842b8a1,http://ufcstats.com/event-details/0ec821423baa26bd
3524,0,Junior Dos Santos  Cain Velasquez,Heavyweight,KO/TKO  Punch,1,1:04,"Anaheim, California, USA",2011-11-12,http://ufcstats.com/fight-details/78294f5d5e0f2b13,http://ufcstats.com/event-details/1c061eb6e29eaa0a
3525,1,Benson Henderson  Clay Guida,Lightweight,U-DEC,3,5:00,"Anaheim, California, USA",2011-11-12,http://ufcstats.com/fight-details/5254658d4e4126c9,http://ufcstats.com/event-details/1c061eb6e29eaa0a
3526,2,Dustin Poirier  Pablo Garza,Featherweight,SUB  D'Arce Choke,2,1:32,"Anaheim, California, USA",2011-11-12,http://ufcstats.com/fight-details/db690563ae7fa070,http://ufcstats.com/event-details/1c061eb6e29eaa0a
3527,3,Ricardo Lamas  Cub Swanson,Featherweight,SUB  Arm Triangle,2,2:16,"Anaheim, California, USA",2011-11-12,http://ufcstats.com/fight-details/0f22781ab4635414,http://ufcstats.com/event-details/1c061eb6e29eaa0a
3528,4,DaMarques Johnson  Clay Harvison,Welterweight,KO/TKO  Punch,1,1:34,"Anaheim, California, USA",2011-11-12,http://ufcstats.com/fight-details/bc7743819590b193,http://ufcstats.com/event-details/1c061eb6e29eaa0a
3529,5,Darren Uyenoyama  Norifumi Yamamoto,Bantamweight,U-DEC,3,5:00,"Anaheim, California, USA",2011-11-12,http://ufcstats.com/fight-details/f0666193c544be4a,http://ufcstats.com/event-details/1c061eb6e29eaa0a
3530,7,Alex Caceres  Cole Escovedo,Bantamweight,U-DEC,3,5:00,"Anaheim, California, USA",2011-11-12,http://ufcstats.com/fight-details/9eed1b277c76f576,http://ufcstats.com/event-details/1c061eb6e29eaa0a
3531,8,Mike Pierce  Paul Bradley,Welterweight,S-DEC,3,5:00,"Anaheim, California, USA",2011-11-12,http://ufcstats.com/fight-details/42a353676554ecf2,http://ufcstats.com/event-details/1c061eb6e29eaa0a
3532,9,Aaron Rosa  Matt Lucas,Light Heavyweight,M-DEC,3,5:00,"Anaheim, California, USA",2011-11-12,http://ufcstats.com/fight-details/48c6c45d9628bb79,http://ufcstats.com/event-details/1c061eb6e29eaa0a
3533,0,Mark Munoz  Chris Leben,Middleweight,KO/TKO,2,5:00,"Birmingham, England, United Kingdom",2011-11-05,http://ufcstats.com/fight-details/3fad8fd8b6e4465d,http://ufcstats.com/event-details/e780ccc79a209985
3534,1,Renan Barao  Brad Pickett,Bantamweight,SUB  Rear Naked Choke,1,4:09,"Birmingham, England, United Kingdom",2011-11-05,http://ufcstats.com/fight-details/3ca05de15ddd658b,http://ufcstats.com/event-details/e780ccc79a209985
3535,2,Thiago Alves  Papy Abedi,Welterweight,SUB  Rear Naked Choke,1,3:32,"Birmingham, England, United Kingdom",2011-11-05,http://ufcstats.com/fight-details/30d0cab706e43838,http://ufcstats.com/event-details/e780ccc79a209985
3536,3,Anthony Perosh  Cyrille Diabate,Light Heavyweight,SUB  Rear Naked Choke,2,3:09,"Birmingham, England, United Kingdom",2011-11-05,http://ufcstats.com/fight-details/da876a1ab4b8eb48,http://ufcstats.com/event-details/e780ccc79a209985
3537,4,Terry Etim  Edward Faaloloto,Lightweight,SUB  Guillotine Choke,1,0:17,"Birmingham, England, United Kingdom",2011-11-05,http://ufcstats.com/fight-details/92030ef8b5796b0a,http://ufcstats.com/event-details/e780ccc79a209985
3538,5,John Maguire  Justin Edwards,Welterweight,U-DEC,3,5:00,"Birmingham, England, United Kingdom",2011-11-05,http://ufcstats.com/fight-details/e623355d7f897b92,http://ufcstats.com/event-details/e780ccc79a209985
3539,6,Philip De Fries  Rob Broughton,Heavyweight,U-DEC,3,5:00,"Birmingham, England, United Kingdom",2011-11-05,http://ufcstats.com/fight-details/b7799cdf8a6470ea,http://ufcstats.com/event-details/e780ccc79a209985
3540,7,Michihiro Omigawa  Jason Young,Featherweight,U-DEC,3,5:00,"Birmingham, England, United Kingdom",2011-11-05,http://ufcstats.com/fight-details/77862f580ce9bca8,http://ufcstats.com/event-details/e780ccc79a209985
3541,8,Che Mills  Chris Cope,Welterweight,KO/TKO  Knee,1,0:40,"Birmingham, England, United Kingdom",2011-11-05,http://ufcstats.com/fight-details/7360ec204d4e0e10,http://ufcstats.com/event-details/e780ccc79a209985
3542,9,Chris Cariaso  Vaughan Lee,Bantamweight,S-DEC,3,5:00,"Birmingham, England, United Kingdom",2011-11-05,http://ufcstats.com/fight-details/3ed2190f1d604432,http://ufcstats.com/event-details/e780ccc79a209985
3543,0,Nick Diaz  BJ Penn,Welterweight,U-DEC,3,5:00,"Las Vegas, Nevada, USA",2011-10-29,http://ufcstats.com/fight-details/0583a3d402bed6e4,http://ufcstats.com/event-details/8788beb528894f33
3544,1,Cheick Kongo  Matt Mitrione,Heavyweight,U-DEC,3,5:00,"Las Vegas, Nevada, USA",2011-10-29,http://ufcstats.com/fight-details/ce05150d524a1829,http://ufcstats.com/event-details/8788beb528894f33
3545,2,Roy Nelson  Mirko Cro Cop,Heavyweight,KO/TKO  Punches,3,1:30,"Las Vegas, Nevada, USA",2011-10-29,http://ufcstats.com/fight-details/9574c1ed9ad25816,http://ufcstats.com/event-details/8788beb528894f33
3546,3,Scott Jorgensen  Jeff Curran,Bantamweight,U-DEC,3,5:00,"Las Vegas, Nevada, USA",2011-10-29,http://ufcstats.com/fight-details/332432834ece3bc7,http://ufcstats.com/event-details/8788beb528894f33
3547,4,Hatsu Hioki  George Roop,Featherweight,S-DEC,3,5:00,"Las Vegas, Nevada, USA",2011-10-29,http://ufcstats.com/fight-details/040f9c9b470f3e6b,http://ufcstats.com/event-details/8788beb528894f33
3548,5,Donald Cerrone  Dennis Siver,Lightweight,SUB  Rear Naked Choke,1,2:22,"Las Vegas, Nevada, USA",2011-10-29,http://ufcstats.com/fight-details/f141416b02a31f4e,http://ufcstats.com/event-details/8788beb528894f33
3549,6,Bart Palaszewski  Tyson Griffin,Featherweight,KO/TKO  Punches,1,2:45,"Las Vegas, Nevada, USA",2011-10-29,http://ufcstats.com/fight-details/8aefe4de7a490de6,http://ufcstats.com/event-details/8788beb528894f33
3550,7,Brandon Vera  Eliot Marshall,Light Heavyweight,U-DEC,3,5:00,"Las Vegas, Nevada, USA",2011-10-29,http://ufcstats.com/fight-details/3ce9fb5e3bdee7b0,http://ufcstats.com/event-details/8788beb528894f33
3551,8,Ramsey Nijem  Danny Downes,Lightweight,U-DEC,3,5:00,"Las Vegas, Nevada, USA",2011-10-29,http://ufcstats.com/fight-details/baf123a5b5fc674c,http://ufcstats.com/event-details/8788beb528894f33
3552,9,Francis Carmont  Chris Camozzi,Middleweight,U-DEC,3,5:00,"Las Vegas, Nevada, USA",2011-10-29,http://ufcstats.com/fight-details/f19a56ecc6c150e3,http://ufcstats.com/event-details/8788beb528894f33
3553,10,Clifford Starks  Dustin Jacoby,Middleweight,U-DEC,3,5:00,"Las Vegas, Nevada, USA",2011-10-29,http://ufcstats.com/fight-details/1a28928b8d7b4c11,http://ufcstats.com/event-details/8788beb528894f33
3554,0,Frankie Edgar  Gray Maynard,Lightweight,KO/TKO  Punches,4,3:54,"Houston, Texas, USA",2011-10-08,http://ufcstats.com/fight-details/8a660069ae42edc2,http://ufcstats.com/event-details/7d5b12de1625984e
3555,1,Jose Aldo  Kenny Florian,Featherweight,U-DEC,5,5:00,"Houston, Texas, USA",2011-10-08,http://ufcstats.com/fight-details/21d2958e13389511,http://ufcstats.com/event-details/7d5b12de1625984e
3556,2,Chael Sonnen  Brian Stann,Middleweight,SUB  Arm Triangle,2,3:51,"Houston, Texas, USA",2011-10-08,http://ufcstats.com/fight-details/63ee688385bf7c69,http://ufcstats.com/event-details/7d5b12de1625984e
3557,3,Nam Phan  Leonard Garcia,Featherweight,U-DEC,3,5:00,"Houston, Texas, USA",2011-10-08,http://ufcstats.com/fight-details/80538f958af30aa0,http://ufcstats.com/event-details/7d5b12de1625984e
3558,4,Joe Lauzon  Melvin Guillard,Lightweight,SUB  Rear Naked Choke,1,0:47,"Houston, Texas, USA",2011-10-08,http://ufcstats.com/fight-details/a369d5ca5aef8b25,http://ufcstats.com/event-details/7d5b12de1625984e
3559,5,Demian Maia  Jorge Santiago,Middleweight,U-DEC,3,5:00,"Houston, Texas, USA",2011-10-08,http://ufcstats.com/fight-details/5f4284409503d874,http://ufcstats.com/event-details/7d5b12de1625984e
3560,6,Anthony Pettis  Jeremy Stephens,Lightweight,S-DEC,3,5:00,"Houston, Texas, USA",2011-10-08,http://ufcstats.com/fight-details/24d92c89c893db42,http://ufcstats.com/event-details/7d5b12de1625984e
3561,7,Stipe Miocic  Joey Beltran,Heavyweight,U-DEC,3,5:00,"Houston, Texas, USA",2011-10-08,http://ufcstats.com/fight-details/9274af24eb96e4b1,http://ufcstats.com/event-details/7d5b12de1625984e
3562,8,Darren Elkins  Tiequan Zhang,Featherweight,U-DEC,3,5:00,"Houston, Texas, USA",2011-10-08,http://ufcstats.com/fight-details/a730a20ab0c61499,http://ufcstats.com/event-details/7d5b12de1625984e
3563,9,Aaron Simpson  Eric Schafer,Middleweight,U-DEC,3,5:00,"Houston, Texas, USA",2011-10-08,http://ufcstats.com/fight-details/b16534d6bb279b2a,http://ufcstats.com/event-details/7d5b12de1625984e
3564,10,Mike Massenzio  Steve Cantwell,Middleweight,U-DEC,3,5:00,"Houston, Texas, USA",2011-10-08,http://ufcstats.com/fight-details/14b450e4ff3c5b97,http://ufcstats.com/event-details/7d5b12de1625984e
3565,0,Dominick Cruz  Demetrious Johnson,Bantamweight,U-DEC,5,5:00,"Washington, DC, USA",2011-10-01,http://ufcstats.com/fight-details/e2433610f128d963,http://ufcstats.com/event-details/44f9c777fed7ca03
3566,1,Stefan Struve  Pat Barry,Heavyweight,SUB  Triangle Choke,2,3:22,"Washington, DC, USA",2011-10-01,http://ufcstats.com/fight-details/008d1123cc90f003,http://ufcstats.com/event-details/44f9c777fed7ca03
3567,2,Anthony Johnson  Charlie Brenneman,Welterweight,KO/TKO  Kick,1,2:49,"Washington, DC, USA",2011-10-01,http://ufcstats.com/fight-details/f914dd2414f9a0ae,http://ufcstats.com/event-details/44f9c777fed7ca03
3568,3,Matt Wiman  Mac Danzig,Lightweight,U-DEC,3,5:00,"Washington, DC, USA",2011-10-01,http://ufcstats.com/fight-details/3542b1fd47163fcd,http://ufcstats.com/event-details/44f9c777fed7ca03
3569,4,Yves Edwards  Rafaello Oliveira,Lightweight,KO/TKO  Kick,2,2:44,"Washington, DC, USA",2011-10-01,http://ufcstats.com/fight-details/765a1fde5ee12784,http://ufcstats.com/event-details/44f9c777fed7ca03
3570,5,Paul Sass  Michael Johnson,Lightweight,SUB  Heel Hook,1,3:00,"Washington, DC, USA",2011-10-01,http://ufcstats.com/fight-details/6aa873e65d880322,http://ufcstats.com/event-details/44f9c777fed7ca03
3571,6,Mike Easton  Byron Bloodworth,Bantamweight,KO/TKO  Knee,2,4:52,"Washington, DC, USA",2011-10-01,http://ufcstats.com/fight-details/d7f151f529543431,http://ufcstats.com/event-details/44f9c777fed7ca03
3572,7,TJ Grant  Shane Roller,Lightweight,SUB  Armbar,3,2:12,"Washington, DC, USA",2011-10-01,http://ufcstats.com/fight-details/cdedc8f026307dd7,http://ufcstats.com/event-details/44f9c777fed7ca03
3573,8,Josh Neer  Keith Wisniewski,Welterweight,KO/TKO,2,5:00,"Washington, DC, USA",2011-10-01,http://ufcstats.com/fight-details/425e856cac6f521b,http://ufcstats.com/event-details/44f9c777fed7ca03
3574,9,Walel Watson  Joseph Sandoval,Bantamweight,KO/TKO  Punches,1,1:17,"Washington, DC, USA",2011-10-01,http://ufcstats.com/fight-details/8bd1f8cb9aa06dcf,http://ufcstats.com/event-details/44f9c777fed7ca03
3575,0,Jon Jones  Rampage Jackson,Light Heavyweight,SUB  Rear Naked Choke,4,1:14,"Denver, Colorado, USA",2011-09-24,http://ufcstats.com/fight-details/181ce41897b37352,http://ufcstats.com/event-details/73ef22f25d0f70e2
3576,1,Josh Koscheck  Matt Hughes,Welterweight,KO/TKO  Punches,1,4:59,"Denver, Colorado, USA",2011-09-24,http://ufcstats.com/fight-details/8133b11f2b7ad634,http://ufcstats.com/event-details/73ef22f25d0f70e2
3577,2,Mark Hunt  Ben Rothwell,Heavyweight,U-DEC,3,5:00,"Denver, Colorado, USA",2011-09-24,http://ufcstats.com/fight-details/cca58aece2816dd1,http://ufcstats.com/event-details/73ef22f25d0f70e2
3578,3,Travis Browne  Rob Broughton,Heavyweight,U-DEC,3,5:00,"Denver, Colorado, USA",2011-09-24,http://ufcstats.com/fight-details/9cb967c62498ff02,http://ufcstats.com/event-details/73ef22f25d0f70e2
3579,4,Nate Diaz  Takanori Gomi,Lightweight,SUB  Armbar,1,4:27,"Denver, Colorado, USA",2011-09-24,http://ufcstats.com/fight-details/fde66b153c65e25d,http://ufcstats.com/event-details/73ef22f25d0f70e2
3580,5,Tony Ferguson  Aaron Riley,Lightweight,KO/TKO,1,5:00,"Denver, Colorado, USA",2011-09-24,http://ufcstats.com/fight-details/3f7c7917a57d2782,http://ufcstats.com/event-details/73ef22f25d0f70e2
3581,6,Tim Boetsch  Nick Ring,Middleweight,U-DEC,3,5:00,"Denver, Colorado, USA",2011-09-24,http://ufcstats.com/fight-details/8af87933e6409e24,http://ufcstats.com/event-details/73ef22f25d0f70e2
3582,7,Junior Assuncao  Eddie Yagin,Featherweight,U-DEC,3,5:00,"Denver, Colorado, USA",2011-09-24,http://ufcstats.com/fight-details/d7d7c9ce3d812eca,http://ufcstats.com/event-details/73ef22f25d0f70e2
3583,8,Takeya Mizugaki  Cole Escovedo,Bantamweight,KO/TKO  Punches,2,4:30,"Denver, Colorado, USA",2011-09-24,http://ufcstats.com/fight-details/eb5b6287ba73640d,http://ufcstats.com/event-details/73ef22f25d0f70e2
