,Unnamed: 0,Fighter,Weight class,Method,Round,Time,location,date,fighturl,eventurl
2340,6,Alejandro Perez  Jose Quinonez,Bantamweight,U-DEC,3,5:00,"Mexico City, Distrito Federal, Mexico",2014-11-15,http://ufcstats.com/fight-details/7a440fcd8048b091,http://ufcstats.com/event-details/59851163aaf1aed8
2341,7,Jessica Eye  Leslie Smith,Women's Bantamweight,KO/TKO,2,1:30,"Mexico City, Distrito Federal, Mexico",2014-11-15,http://ufcstats.com/fight-details/07f9fc40f1e6aa87,http://ufcstats.com/event-details/59851163aaf1aed8
2342,8,Gabriel Benitez  Humberto Brown,Featherweight,SUB  Guillotine Choke,3,0:30,"Mexico City, Distrito Federal, Mexico",2014-11-15,http://ufcstats.com/fight-details/4087bb7b3b1b9e24,http://ufcstats.com/event-details/59851163aaf1aed8
2343,9,Henry Briones  Guido Cannetti,Bantamweight,SUB  Rear Naked Choke,2,1:44,"Mexico City, Distrito Federal, Mexico",2014-11-15,http://ufcstats.com/fight-details/a788042d4d0c50d4,http://ufcstats.com/event-details/59851163aaf1aed8
2344,10,Marco Beltran  Marlon Vera,Bantamweight,U-DEC,3,5:00,"Mexico City, Distrito Federal, Mexico",2014-11-15,http://ufcstats.com/fight-details/22f52e3b614e0d8a,http://ufcstats.com/event-details/59851163aaf1aed8
2345,0,Ovince Saint Preux  Mauricio Rua,Light Heavyweight,KO/TKO  Punch,1,0:34,"Uberlandia, Minas Gerais, Brazil",2014-11-08,http://ufcstats.com/fight-details/e8907b881151b79d,http://ufcstats.com/event-details/6ca68b636fbc1f18
2346,1,Warlley Alves  Alan Jouban,Welterweight,U-DEC,3,5:00,"Uberlandia, Minas Gerais, Brazil",2014-11-08,http://ufcstats.com/fight-details/cbe954d004415b51,http://ufcstats.com/event-details/6ca68b636fbc1f18
2347,2,Claudio Silva  Leon Edwards,Welterweight,S-DEC,3,5:00,"Uberlandia, Minas Gerais, Brazil",2014-11-08,http://ufcstats.com/fight-details/a3480aa7bdc63c11,http://ufcstats.com/event-details/6ca68b636fbc1f18
2348,3,Dhiego Lima  Jorge de Oliveira,Welterweight,U-DEC,3,5:00,"Uberlandia, Minas Gerais, Brazil",2014-11-08,http://ufcstats.com/fight-details/fadb129e71d8fc22,http://ufcstats.com/event-details/6ca68b636fbc1f18
2349,4,Juliana Lima  Nina Ansaroff,Women's Strawweight,U-DEC,3,5:00,"Uberlandia, Minas Gerais, Brazil",2014-11-08,http://ufcstats.com/fight-details/db9f8144b50227f2,http://ufcstats.com/event-details/6ca68b636fbc1f18
2350,5,Diego Rivas  Rodolfo Rubio,Featherweight,U-DEC,3,5:00,"Uberlandia, Minas Gerais, Brazil",2014-11-08,http://ufcstats.com/fight-details/7826c23386a1e09a,http://ufcstats.com/event-details/6ca68b636fbc1f18
2351,6,Caio Magalhaes  Trevor Smith,Middleweight,KO/TKO  Punch,1,0:31,"Uberlandia, Minas Gerais, Brazil",2014-11-08,http://ufcstats.com/fight-details/208674403b0936d4,http://ufcstats.com/event-details/6ca68b636fbc1f18
2352,7,Leandro Silva  Charlie Brenneman,Lightweight,SUB  Rear Naked Choke,1,4:15,"Uberlandia, Minas Gerais, Brazil",2014-11-08,http://ufcstats.com/fight-details/207f105716df54f9,http://ufcstats.com/event-details/6ca68b636fbc1f18
2353,8,Thomas Almeida  Tim Gorman,Bantamweight,U-DEC,3,5:00,"Uberlandia, Minas Gerais, Brazil",2014-11-08,http://ufcstats.com/fight-details/49b05e23e3a2af13,http://ufcstats.com/event-details/6ca68b636fbc1f18
2354,9,Colby Covington  Wagner Silva,Welterweight,SUB  Rear Naked Choke,3,3:26,"Uberlandia, Minas Gerais, Brazil",2014-11-08,http://ufcstats.com/fight-details/cccb99dd4ec5c2d6,http://ufcstats.com/event-details/6ca68b636fbc1f18
2355,0,Luke Rockhold  Michael Bisping,Middleweight,SUB  Guillotine Choke,2,0:57,"Sydney, New South Wales, Australia",2014-11-07,http://ufcstats.com/fight-details/3d741cee0dffe165,http://ufcstats.com/event-details/371a1c91b24dec2b
2356,1,Al Iaquinta  Ross Pearson,Lightweight,KO/TKO  Punch,2,1:39,"Sydney, New South Wales, Australia",2014-11-07,http://ufcstats.com/fight-details/73954f3895cac499,http://ufcstats.com/event-details/371a1c91b24dec2b
2357,2,Robert Whittaker  Clint Hester,Middleweight,KO/TKO  Knee,2,2:43,"Sydney, New South Wales, Australia",2014-11-07,http://ufcstats.com/fight-details/13c4251fb451f440,http://ufcstats.com/event-details/371a1c91b24dec2b
2358,3,Soa Palelei  Walt Harris,Heavyweight,KO/TKO  Punches,2,4:49,"Sydney, New South Wales, Australia",2014-11-07,http://ufcstats.com/fight-details/3e9f3ce3a01bb97f,http://ufcstats.com/event-details/371a1c91b24dec2b
2359,4,Jake Matthews  Vagner Rocha,Lightweight,SUB  Rear Naked Choke,2,1:52,"Sydney, New South Wales, Australia",2014-11-07,http://ufcstats.com/fight-details/2faa7b48b4d51cab,http://ufcstats.com/event-details/371a1c91b24dec2b
2360,5,Anthony Perosh  Guto Inocente,Light Heavyweight,SUB  Rear Naked Choke,1,3:46,"Sydney, New South Wales, Australia",2014-11-07,http://ufcstats.com/fight-details/b1e7100c2ab1ab79,http://ufcstats.com/event-details/371a1c91b24dec2b
2361,6,Sam Alvey  Dylan Andrews,Middleweight,KO/TKO  Punches,1,2:16,"Sydney, New South Wales, Australia",2014-11-07,http://ufcstats.com/fight-details/920b8aae22c04f13,http://ufcstats.com/event-details/371a1c91b24dec2b
2362,7,Louis Smolka  Richie Vaculik,Flyweight,KO/TKO  Kick,3,0:18,"Sydney, New South Wales, Australia",2014-11-07,http://ufcstats.com/fight-details/0f0473dde4b873ca,http://ufcstats.com/event-details/371a1c91b24dec2b
2363,8,Chris Clements  Vik Grujic,Welterweight,KO/TKO  Knee,1,3:06,"Sydney, New South Wales, Australia",2014-11-07,http://ufcstats.com/fight-details/681d77e5d5c0f0ee,http://ufcstats.com/event-details/371a1c91b24dec2b
2364,9,Daniel Kelly  Luke Zachrich,Middleweight,SUB  Kimura,1,4:27,"Sydney, New South Wales, Australia",2014-11-07,http://ufcstats.com/fight-details/3a7d76e3c0b503c3,http://ufcstats.com/event-details/371a1c91b24dec2b
2365,10,Marcus Brimage  Jumabieke Tuerxun,Bantamweight,KO/TKO  Kick,1,2:58,"Sydney, New South Wales, Australia",2014-11-07,http://ufcstats.com/fight-details/c3d336f9aabc9fb6,http://ufcstats.com/event-details/371a1c91b24dec2b
2366,0,Jose Aldo  Chad Mendes,Featherweight,U-DEC,5,5:00,"Rio de Janeiro, Brazil",2014-10-25,http://ufcstats.com/fight-details/7099374e91f9283b,http://ufcstats.com/event-details/53f02bbc41d99432
2367,1,Phil Davis  Glover Teixeira,Light Heavyweight,U-DEC,3,5:00,"Rio de Janeiro, Brazil",2014-10-25,http://ufcstats.com/fight-details/06854105c3503075,http://ufcstats.com/event-details/53f02bbc41d99432
2368,2,Fabio Maldonado  Hans Stringer,Light Heavyweight,KO/TKO  Punches,2,4:06,"Rio de Janeiro, Brazil",2014-10-25,http://ufcstats.com/fight-details/2bfb60face19904d,http://ufcstats.com/event-details/53f02bbc41d99432
2369,3,Darren Elkins  Lucas Martins,Featherweight,S-DEC,3,5:00,"Rio de Janeiro, Brazil",2014-10-25,http://ufcstats.com/fight-details/ffd3e3d37cba32da,http://ufcstats.com/event-details/53f02bbc41d99432
2370,4,Beneil Dariush  Diego Ferreira,Lightweight,U-DEC,3,5:00,"Rio de Janeiro, Brazil",2014-10-25,http://ufcstats.com/fight-details/852223ee1a2d0a74,http://ufcstats.com/event-details/53f02bbc41d99432
2371,5,Neil Magny  William Patolino,Welterweight,KO/TKO  Punches,3,2:40,"Rio de Janeiro, Brazil",2014-10-25,http://ufcstats.com/fight-details/d1b2ce8ee57307c0,http://ufcstats.com/event-details/53f02bbc41d99432
2372,6,Yan Cabral  Naoyuki Kotani,Lightweight,SUB  Rear Naked Choke,2,3:06,"Rio de Janeiro, Brazil",2014-10-25,http://ufcstats.com/fight-details/502d7cb01921170f,http://ufcstats.com/event-details/53f02bbc41d99432
2373,7,Wilson Reis  Scott Jorgensen,Flyweight,SUB  Arm Triangle,1,3:28,"Rio de Janeiro, Brazil",2014-10-25,http://ufcstats.com/fight-details/a90fde18a088f99b,http://ufcstats.com/event-details/53f02bbc41d99432
2374,8,Andre Fili  Felipe Arantes,Featherweight,U-DEC,3,5:00,"Rio de Janeiro, Brazil",2014-10-25,http://ufcstats.com/fight-details/432e57033ceecee0,http://ufcstats.com/event-details/53f02bbc41d99432
2375,9,Gilbert Burns  Christos Giagos,Lightweight,SUB  Armbar,1,4:57,"Rio de Janeiro, Brazil",2014-10-25,http://ufcstats.com/fight-details/2a44035824303dee,http://ufcstats.com/event-details/53f02bbc41d99432
2376,10,Anthony Rocco Martin  Fabricio Camoes,Lightweight,SUB  Kimura,1,4:16,"Rio de Janeiro, Brazil",2014-10-25,http://ufcstats.com/fight-details/4cc9ef5e68009fd4,http://ufcstats.com/event-details/53f02bbc41d99432
2377,0,Rory MacDonald  Tarec Saffiedine,Welterweight,KO/TKO  Punch,3,1:28,"Halifax, Nova Scotia, Canada",2014-10-04,http://ufcstats.com/fight-details/64542fe846b9aea9,http://ufcstats.com/event-details/0313bf497de9c470
2378,1,Raphael Assuncao  Bryan Caraway,Bantamweight,U-DEC,3,5:00,"Halifax, Nova Scotia, Canada",2014-10-04,http://ufcstats.com/fight-details/06fab49a307ff3d2,http://ufcstats.com/event-details/0313bf497de9c470
2379,2,Chad Laprise  Yosdenis Cedeno,Lightweight,U-DEC,3,5:00,"Halifax, Nova Scotia, Canada",2014-10-04,http://ufcstats.com/fight-details/20af0f55d226f320,http://ufcstats.com/event-details/0313bf497de9c470
2380,3,Elias Theodorou  Bruno Santos,Middleweight,U-DEC,3,5:00,"Halifax, Nova Scotia, Canada",2014-10-04,http://ufcstats.com/fight-details/7e25199be406dd7b,http://ufcstats.com/event-details/0313bf497de9c470
2381,4,Nordine Taleb  Jingliang Li,Welterweight,S-DEC,3,5:00,"Halifax, Nova Scotia, Canada",2014-10-04,http://ufcstats.com/fight-details/5e07077e84fc45cd,http://ufcstats.com/event-details/0313bf497de9c470
2382,5,Mitch Gagnon  Roman Salazar,Bantamweight,SUB  Rear Naked Choke,1,2:06,"Halifax, Nova Scotia, Canada",2014-10-04,http://ufcstats.com/fight-details/2d13778322a8af82,http://ufcstats.com/event-details/0313bf497de9c470
2383,6,Daron Cruickshank  Anthony Njokuani,Lightweight,U-DEC,3,5:00,"Halifax, Nova Scotia, Canada",2014-10-04,http://ufcstats.com/fight-details/88933cf1edd83034,http://ufcstats.com/event-details/0313bf497de9c470
2384,7,Olivier Aubin-Mercier  Jake Lindsey,Lightweight,SUB  Other - Choke,2,3:22,"Halifax, Nova Scotia, Canada",2014-10-04,http://ufcstats.com/fight-details/2d1f8ee74824f983,http://ufcstats.com/event-details/0313bf497de9c470
2385,8,Paul Felder  Jason Saggo,Lightweight,S-DEC,3,5:00,"Halifax, Nova Scotia, Canada",2014-10-04,http://ufcstats.com/fight-details/4e981b587c1012dd,http://ufcstats.com/event-details/0313bf497de9c470
2386,9,Chris Kelades  Paddy Holohan,Flyweight,U-DEC,3,5:00,"Halifax, Nova Scotia, Canada",2014-10-04,http://ufcstats.com/fight-details/17bb1e62772ac5af,http://ufcstats.com/event-details/0313bf497de9c470
2387,10,Albert Tumenov  Matt Dwyer,Welterweight,KO/TKO  Kick,1,1:03,"Halifax, Nova Scotia, Canada",2014-10-04,http://ufcstats.com/fight-details/4664432c0d592411,http://ufcstats.com/event-details/0313bf497de9c470
2388,0,Rick Story  Gunnar Nelson,Welterweight,S-DEC,5,5:00,"Stockholm, Sweden",2014-10-04,http://ufcstats.com/fight-details/da26301ae3e7a9b1,http://ufcstats.com/event-details/8dc4f34c1f50d00d
2389,1,Max Holloway  Akira Corassani,Featherweight,KO/TKO  Punch,1,3:11,"Stockholm, Sweden",2014-10-04,http://ufcstats.com/fight-details/ca16e203eb2bde60,http://ufcstats.com/event-details/8dc4f34c1f50d00d
2390,2,Jan Blachowicz  Ilir Latifi,Light Heavyweight,KO/TKO  Kick,1,1:58,"Stockholm, Sweden",2014-10-04,http://ufcstats.com/fight-details/699a70c8fb3c0273,http://ufcstats.com/event-details/8dc4f34c1f50d00d
2391,3,Mike Wilkinson  Niklas Backstrom,Featherweight,KO/TKO  Punch,1,1:19,"Stockholm, Sweden",2014-10-04,http://ufcstats.com/fight-details/5ed0027812582ad9,http://ufcstats.com/event-details/8dc4f34c1f50d00d
2392,4,Magnus Cedenblad  Scott Askham,Middleweight,U-DEC,3,5:00,"Stockholm, Sweden",2014-10-04,http://ufcstats.com/fight-details/5563d6de0b4c4d65,http://ufcstats.com/event-details/8dc4f34c1f50d00d
2393,5,Nico Musoke  Alexander Yakovlev,Welterweight,U-DEC,3,5:00,"Stockholm, Sweden",2014-10-04,http://ufcstats.com/fight-details/562d3261ca7bdf01,http://ufcstats.com/event-details/8dc4f34c1f50d00d
2394,6,Dennis Siver  Charles Rosa,Featherweight,U-DEC,3,5:00,"Stockholm, Sweden",2014-10-04,http://ufcstats.com/fight-details/24ac3d1bee1610ef,http://ufcstats.com/event-details/8dc4f34c1f50d00d
2395,7,Cathal Pendred  Gasan Umalatov,Welterweight,S-DEC,3,5:00,"Stockholm, Sweden",2014-10-04,http://ufcstats.com/fight-details/63e21ff20866b8fb,http://ufcstats.com/event-details/8dc4f34c1f50d00d
2396,8,Krzysztof Jotko  Tor Troeng,Middleweight,U-DEC,3,5:00,"Stockholm, Sweden",2014-10-04,http://ufcstats.com/fight-details/6c62796d9b7e94a0,http://ufcstats.com/event-details/8dc4f34c1f50d00d
2397,9,Mairbek Taisumov  Marcin Bandel,Lightweight,KO/TKO  Punch,1,1:01,"Stockholm, Sweden",2014-10-04,http://ufcstats.com/fight-details/23692b9936363da3,http://ufcstats.com/event-details/8dc4f34c1f50d00d
2398,10,Zubaira Tukhugov  Ernest Chavez,Featherweight,KO/TKO  Punches,1,4:21,"Stockholm, Sweden",2014-10-04,http://ufcstats.com/fight-details/75a88258eb967e0c,http://ufcstats.com/event-details/8dc4f34c1f50d00d
2399,0,Demetrious Johnson  Chris Cariaso,Flyweight,SUB  Kimura,2,2:29,"Las Vegas, Nevada, USA",2014-09-27,http://ufcstats.com/fight-details/79c2461046e17eba,http://ufcstats.com/event-details/3bb030257966b022
2400,1,Donald Cerrone  Eddie Alvarez,Lightweight,U-DEC,3,5:00,"Las Vegas, Nevada, USA",2014-09-27,http://ufcstats.com/fight-details/64eb4ae171613218,http://ufcstats.com/event-details/3bb030257966b022
2401,2,Conor McGregor  Dustin Poirier,Featherweight,KO/TKO  Punch,1,1:46,"Las Vegas, Nevada, USA",2014-09-27,http://ufcstats.com/fight-details/6bcea00473e43a59,http://ufcstats.com/event-details/3bb030257966b022
2402,3,Yoel Romero  Tim Kennedy,Middleweight,KO/TKO  Punch,3,0:58,"Las Vegas, Nevada, USA",2014-09-27,http://ufcstats.com/fight-details/3e3db8c37096c260,http://ufcstats.com/event-details/3bb030257966b022
2403,4,Cat Zingano  Amanda Nunes,Women's Bantamweight,KO/TKO  Punches,3,1:21,"Las Vegas, Nevada, USA",2014-09-27,http://ufcstats.com/fight-details/b1b82605646eb850,http://ufcstats.com/event-details/3bb030257966b022
2404,5,Dominick Cruz  Takeya Mizugaki,Bantamweight,KO/TKO  Punches,1,1:01,"Las Vegas, Nevada, USA",2014-09-27,http://ufcstats.com/fight-details/72656e864ca1c972,http://ufcstats.com/event-details/3bb030257966b022
2405,6,Jorge Masvidal  James Krause,Lightweight,U-DEC,3,5:00,"Las Vegas, Nevada, USA",2014-09-27,http://ufcstats.com/fight-details/65f4d4f44e6e73f7,http://ufcstats.com/event-details/3bb030257966b022
2406,7,Stephen Thompson  Patrick Cote,Welterweight,U-DEC,3,5:00,"Las Vegas, Nevada, USA",2014-09-27,http://ufcstats.com/fight-details/fceab09944a65840,http://ufcstats.com/event-details/3bb030257966b022
2407,8,Brian Ebersole  John Howard,Welterweight,S-DEC,3,5:00,"Las Vegas, Nevada, USA",2014-09-27,http://ufcstats.com/fight-details/fc45644c62643c71,http://ufcstats.com/event-details/3bb030257966b022
2408,9,Kevin Lee  Jon Tuck,Lightweight,U-DEC,3,5:00,"Las Vegas, Nevada, USA",2014-09-27,http://ufcstats.com/fight-details/9c0721bd410e7a0e,http://ufcstats.com/event-details/3bb030257966b022
2409,10,Manvel Gamburyan  Cody Gibson,Bantamweight,SUB  Guillotine Choke,2,4:56,"Las Vegas, Nevada, USA",2014-09-27,http://ufcstats.com/fight-details/a49706a6edb0c5c3,http://ufcstats.com/event-details/3bb030257966b022
2410,0,Mark Hunt  Roy Nelson,Heavyweight,KO/TKO  Punch,2,3:00,"Saitama, Japan",2014-09-20,http://ufcstats.com/fight-details/ef3c1a2ac6510d26,http://ufcstats.com/event-details/2dea80c069847321
2411,1,Myles Jury  Takanori Gomi,Lightweight,KO/TKO  Punch,1,1:32,"Saitama, Japan",2014-09-20,http://ufcstats.com/fight-details/5ff0c4c6006f0873,http://ufcstats.com/event-details/2dea80c069847321
2412,2,Yoshihiro Akiyama  Amir Sadollah,Welterweight,U-DEC,3,5:00,"Saitama, Japan",2014-09-20,http://ufcstats.com/fight-details/1e797ccd275a98d0,http://ufcstats.com/event-details/2dea80c069847321
2413,3,Miesha Tate  Rin Nakai,Women's Bantamweight,U-DEC,3,5:00,"Saitama, Japan",2014-09-20,http://ufcstats.com/fight-details/36d9d7e331e6b589,http://ufcstats.com/event-details/2dea80c069847321
2414,4,Kiichi Kunimoto  Richard Walsh,Welterweight,S-DEC,3,5:00,"Saitama, Japan",2014-09-20,http://ufcstats.com/fight-details/26cd506de4221057,http://ufcstats.com/event-details/2dea80c069847321
2415,5,Kyoji Horiguchi  Jon Delos Reyes,Flyweight,KO/TKO  Punches,1,3:48,"Saitama, Japan",2014-09-20,http://ufcstats.com/fight-details/c2a36e996bba3a4a,http://ufcstats.com/event-details/2dea80c069847321
2416,6,Masanori Kanehara  Alex Caceres,Bantamweight,U-DEC,3,5:00,"Saitama, Japan",2014-09-20,http://ufcstats.com/fight-details/b516beb27416e492,http://ufcstats.com/event-details/2dea80c069847321
2417,7,Katsunori Kikuno  Sam Sicilia,Featherweight,SUB  Rear Naked Choke,2,1:38,"Saitama, Japan",2014-09-20,http://ufcstats.com/fight-details/7690e946d9d81f51,http://ufcstats.com/event-details/2dea80c069847321
2418,8,Hyun Gyu Lim  Takenori Sato,Welterweight,KO/TKO  Elbows,1,1:18,"Saitama, Japan",2014-09-20,http://ufcstats.com/fight-details/de2dad48d95305d7,http://ufcstats.com/event-details/2dea80c069847321
2419,9,Kyung Ho Kang  Michinori Tanaka,Bantamweight,S-DEC,3,5:00,"Saitama, Japan",2014-09-20,http://ufcstats.com/fight-details/a4398b9257a93d78,http://ufcstats.com/event-details/2dea80c069847321
2420,10,Johnny Case  Kazuki Tokudome,Lightweight,SUB  Guillotine Choke,2,2:34,"Saitama, Japan",2014-09-20,http://ufcstats.com/fight-details/3dd55cca2358a511,http://ufcstats.com/event-details/2dea80c069847321
2421,11,Maximo Blanco  Dan Hooker,Featherweight,U-DEC,3,5:00,"Saitama, Japan",2014-09-20,http://ufcstats.com/fight-details/284e05afc9479620,http://ufcstats.com/event-details/2dea80c069847321
2422,0,Andrei Arlovski  Antonio Silva,Heavyweight,KO/TKO  Punch,1,2:59,"Brasilia, Distrito Federal, Brazil",2014-09-13,http://ufcstats.com/fight-details/61c9bbeb2806534b,http://ufcstats.com/event-details/a71feb7ea7592a71
2423,1,Gleison Tibau  Piotr Hallmann,Lightweight,S-DEC,3,5:00,"Brasilia, Distrito Federal, Brazil",2014-09-13,http://ufcstats.com/fight-details/246f38c7855a6400,http://ufcstats.com/event-details/a71feb7ea7592a71
2424,2,Leonardo Santos  Efrain Escudero,Lightweight,U-DEC,3,5:00,"Brasilia, Distrito Federal, Brazil",2014-09-13,http://ufcstats.com/fight-details/72d2ab073f4120a4,http://ufcstats.com/event-details/a71feb7ea7592a71
2425,3,Santiago Ponzinibbio  Wendell Oliveira,Welterweight,KO/TKO  Punches,1,1:20,"Brasilia, Distrito Federal, Brazil",2014-09-13,http://ufcstats.com/fight-details/033e4538b9014f91,http://ufcstats.com/event-details/a71feb7ea7592a71
2426,4,Iuri Alcantara  Russell Doane,Bantamweight,U-DEC,3,5:00,"Brasilia, Distrito Federal, Brazil",2014-09-13,http://ufcstats.com/fight-details/36c2ce10809f17b3,http://ufcstats.com/event-details/a71feb7ea7592a71
2427,5,Jessica Andrade  Larissa Pacheco,Women's Bantamweight,SUB  Guillotine Choke,1,4:33,"Brasilia, Distrito Federal, Brazil",2014-09-13,http://ufcstats.com/fight-details/2798c746fe93502a,http://ufcstats.com/event-details/a71feb7ea7592a71
2428,6,Godofredo Pepey  Dashon Johnson,Featherweight,SUB  Armbar,1,4:29,"Brasilia, Distrito Federal, Brazil",2014-09-13,http://ufcstats.com/fight-details/7580c93fec606442,http://ufcstats.com/event-details/a71feb7ea7592a71
2429,7,George Sullivan  Igor Araujo,Welterweight,KO/TKO  Punch,2,2:31,"Brasilia, Distrito Federal, Brazil",2014-09-13,http://ufcstats.com/fight-details/ebb9eeac1faf73ed,http://ufcstats.com/event-details/a71feb7ea7592a71
2430,8,Francisco Trinaldo  Leandro Silva,Lightweight,U-DEC,3,5:00,"Brasilia, Distrito Federal, Brazil",2014-09-13,http://ufcstats.com/fight-details/e79e3ee088b76d46,http://ufcstats.com/event-details/a71feb7ea7592a71
2431,9,Sean Spencer  Paulo Thiago,Welterweight,U-DEC,3,5:00,"Brasilia, Distrito Federal, Brazil",2014-09-13,http://ufcstats.com/fight-details/972b0643185b2570,http://ufcstats.com/event-details/a71feb7ea7592a71
2432,10,Rani Yahya  Johnny Bedford,Bantamweight,SUB  Kimura,2,2:04,"Brasilia, Distrito Federal, Brazil",2014-09-13,http://ufcstats.com/fight-details/6f19f24780c4f23f,http://ufcstats.com/event-details/a71feb7ea7592a71
2433,0,Jacare Souza  Gegard Mousasi,Middleweight,SUB  Guillotine Choke,3,4:30,"Ledyard, Connecticut, USA",2014-09-05,http://ufcstats.com/fight-details/80faf0c138d20999,http://ufcstats.com/event-details/9bcfb40dbcd50568
2434,1,Ben Rothwell  Alistair Overeem,Heavyweight,KO/TKO  Punch,1,2:19,"Ledyard, Connecticut, USA",2014-09-05,http://ufcstats.com/fight-details/1520290d28b75b53,http://ufcstats.com/event-details/9bcfb40dbcd50568
2435,2,Matt Mitrione  Derrick Lewis,Heavyweight,KO/TKO  Punches,1,0:41,"Ledyard, Connecticut, USA",2014-09-05,http://ufcstats.com/fight-details/fd4d5685c2e207b5,http://ufcstats.com/event-details/9bcfb40dbcd50568
2436,3,Joe Lauzon  Michael Chiesa,Lightweight,KO/TKO,2,2:14,"Ledyard, Connecticut, USA",2014-09-05,http://ufcstats.com/fight-details/c9733393385105cb,http://ufcstats.com/event-details/9bcfb40dbcd50568
2437,4,John Moraga  Justin Scoggins,Flyweight,SUB  Guillotine Choke,2,0:47,"Ledyard, Connecticut, USA",2014-09-05,http://ufcstats.com/fight-details/839c8cd7b1a32c7c,http://ufcstats.com/event-details/9bcfb40dbcd50568
2438,5,Al Iaquinta  Rodrigo Damm,Lightweight,KO/TKO  Elbows,3,2:26,"Ledyard, Connecticut, USA",2014-09-05,http://ufcstats.com/fight-details/1c980547431ddcef,http://ufcstats.com/event-details/9bcfb40dbcd50568
2439,6,Rafael Natal  Chris Camozzi,Middleweight,S-DEC,3,5:00,"Ledyard, Connecticut, USA",2014-09-05,http://ufcstats.com/fight-details/98e21492b6bc15d3,http://ufcstats.com/event-details/9bcfb40dbcd50568
2440,7,Chris Beal  Tateki Matsuda,Bantamweight,U-DEC,3,5:00,"Ledyard, Connecticut, USA",2014-09-05,http://ufcstats.com/fight-details/603b0b1fa3ab8f20,http://ufcstats.com/event-details/9bcfb40dbcd50568
2441,8,Chas Skelly  Sean Soriano,Featherweight,U-DEC,3,5:00,"Ledyard, Connecticut, USA",2014-09-05,http://ufcstats.com/fight-details/7ba4a04673307cc9,http://ufcstats.com/event-details/9bcfb40dbcd50568
2442,0,TJ Dillashaw  Joe Soto,Bantamweight,KO/TKO  Kick,5,2:20,"Sacramento, California, USA",2014-08-30,http://ufcstats.com/fight-details/e8c16b26a4bfe163,http://ufcstats.com/event-details/269d103c96a4c3a5
2443,1,Tony Ferguson  Danny Castillo,Lightweight,S-DEC,3,5:00,"Sacramento, California, USA",2014-08-30,http://ufcstats.com/fight-details/ae0b5ab5bc4bb6a7,http://ufcstats.com/event-details/269d103c96a4c3a5
2444,2,Bethe Correia  Shayna Baszler,Women's Bantamweight,KO/TKO  Punches,2,1:56,"Sacramento, California, USA",2014-08-30,http://ufcstats.com/fight-details/8452ff5ae6316931,http://ufcstats.com/event-details/269d103c96a4c3a5
2445,3,Diego Ferreira  Ramsey Nijem,Lightweight,KO/TKO  Punch,2,1:53,"Sacramento, California, USA",2014-08-30,http://ufcstats.com/fight-details/1748b2b5aabe23a5,http://ufcstats.com/event-details/269d103c96a4c3a5
2446,4,Yancy Medeiros  Damon Jackson,Lightweight,SUB  Other - Choke,2,1:54,"Sacramento, California, USA",2014-08-30,http://ufcstats.com/fight-details/7cfb05c08ec91525,http://ufcstats.com/event-details/269d103c96a4c3a5
2447,5,Derek Brunson  Lorenz Larkin,Middleweight,U-DEC,3,5:00,"Sacramento, California, USA",2014-08-30,http://ufcstats.com/fight-details/bd83e4a6f216230f,http://ufcstats.com/event-details/269d103c96a4c3a5
2448,6,Anthony Hamilton  Ruan Potts,Heavyweight,KO/TKO  Punches,2,4:17,"Sacramento, California, USA",2014-08-30,http://ufcstats.com/fight-details/c303b8a07d0d06d2,http://ufcstats.com/event-details/269d103c96a4c3a5
2449,7,Chris Wade  Cain Carrizosa,Lightweight,SUB  Guillotine Choke,1,1:12,"Sacramento, California, USA",2014-08-30,http://ufcstats.com/fight-details/788c4bbf925cdf40,http://ufcstats.com/event-details/269d103c96a4c3a5
2450,0,Rafael Dos Anjos  Benson Henderson,Lightweight,KO/TKO  Punch,1,2:31,"Tulsa, Oklahoma, USA",2014-08-23,http://ufcstats.com/fight-details/351532f2fe6804d1,http://ufcstats.com/event-details/063649e21bc9d6d5
2451,1,Jordan Mein  Mike Pyle,Welterweight,KO/TKO  Punch,1,1:12,"Tulsa, Oklahoma, USA",2014-08-23,http://ufcstats.com/fight-details/c7765a3255701267,http://ufcstats.com/event-details/063649e21bc9d6d5
2452,2,Thales Leites  Francis Carmont,Middleweight,KO/TKO  Punch,2,0:20,"Tulsa, Oklahoma, USA",2014-08-23,http://ufcstats.com/fight-details/735ed861dee80d25,http://ufcstats.com/event-details/063649e21bc9d6d5
2453,3,Max Holloway  Clay Collard,Catch Weight,KO/TKO  Punches,3,3:47,"Tulsa, Oklahoma, USA",2014-08-23,http://ufcstats.com/fight-details/56fbc2a376569c13,http://ufcstats.com/event-details/063649e21bc9d6d5
2454,4,James Vick  Valmir Lazaro,Lightweight,U-DEC,3,5:00,"Tulsa, Oklahoma, USA",2014-08-23,http://ufcstats.com/fight-details/20f0129fc4861674,http://ufcstats.com/event-details/063649e21bc9d6d5
2455,5,Chas Skelly  Tom Niinimaki,Featherweight,SUB  Rear Naked Choke,1,2:35,"Tulsa, Oklahoma, USA",2014-08-23,http://ufcstats.com/fight-details/e8f6232d12d52b58,http://ufcstats.com/event-details/063649e21bc9d6d5
2456,6,Neil Magny  Alex Garcia,Welterweight,U-DEC,3,5:00,"Tulsa, Oklahoma, USA",2014-08-23,http://ufcstats.com/fight-details/954362efa4564d60,http://ufcstats.com/event-details/063649e21bc9d6d5
2457,7,Beneil Dariush  Anthony Rocco Martin,Lightweight,SUB  Arm Triangle,2,3:38,"Tulsa, Oklahoma, USA",2014-08-23,http://ufcstats.com/fight-details/53fe9da9fb8d4f88,http://ufcstats.com/event-details/063649e21bc9d6d5
2458,8,Matt Hobar  Aaron Phillips,Bantamweight,U-DEC,3,5:00,"Tulsa, Oklahoma, USA",2014-08-23,http://ufcstats.com/fight-details/b2867869d4eb98ce,http://ufcstats.com/event-details/063649e21bc9d6d5
2459,9,Ben Saunders  Chris Heatherly,Welterweight,SUB  Omoplata,1,2:18,"Tulsa, Oklahoma, USA",2014-08-23,http://ufcstats.com/fight-details/bb9c60bc6924f373,http://ufcstats.com/event-details/063649e21bc9d6d5
2460,10,Wilson Reis  Joby Sanchez,Flyweight,U-DEC,3,5:00,"Tulsa, Oklahoma, USA",2014-08-23,http://ufcstats.com/fight-details/01be9ab42f1fd8e6,http://ufcstats.com/event-details/063649e21bc9d6d5
2461,0,Michael Bisping  Cung Le,Middleweight,KO/TKO  Knee,4,0:57,"Macau, China",2014-08-23,http://ufcstats.com/fight-details/a57b9c636ac198be,http://ufcstats.com/event-details/770b9d4813c25902
2462,1,Tyron Woodley  Dong Hyun Kim,Welterweight,KO/TKO  Punch,1,1:01,"Macau, China",2014-08-23,http://ufcstats.com/fight-details/7cde85d46dc0bebe,http://ufcstats.com/event-details/770b9d4813c25902
